commit	suite	tasks	success_rate	strict_success_rate	json_valid_rate	selector_hit_rate	actions_per_success	p50_s	p95_s	timeout_rate	model_load_s	status	description
20cfb0b	local-fake-extension	39	1.0000	1.0000	1.0000	1.0000	1.41	0.003	0.009	0.0000	0.000	baseline	textarea recovery baseline local
20cfb0b	local-fake-extension	40	1.0000	1.0000	1.0000	1.0000	1.45	0.003	0.006	0.0000	0.000	keep	textarea recovery local
20cfb0b	real-chrome-extension-smoke	35	1.0000	1.0000	1.0000	1.0000	1.31	0.006	0.017	0.0000	0.000	keep	textarea recovery real smoke
20cfb0b	real-chrome-extension-agent	40	1.0000	1.0000	1.0000	1.0000	1.45	0.008	4.186	0.0000	0.001	keep	textarea recovery real agent
60c0075	local-fake-extension	40	1.0000	1.0000	1.0000	1.0000	1.45	0.003	0.007	0.0000	0.000	baseline	checkbox recovery baseline local
60c0075	local-fake-extension	42	1.0000	1.0000	1.0000	1.0000	1.48	0.003	0.006	0.0000	0.000	keep	checkbox recovery local
60c0075	real-chrome-extension-smoke	37	1.0000	1.0000	1.0000	1.0000	1.35	0.008	0.021	0.0000	0.000	keep	checkbox recovery real smoke
60c0075	real-chrome-extension-agent	42	1.0000	1.0000	1.0000	1.0000	1.48	0.008	4.220	0.0000	0.002	keep	checkbox recovery real agent
c62f0d9	local-fake-extension	42	1.0000	1.0000	1.0000	1.0000	1.48	0.003	0.007	0.0000	0.000	baseline	radio recovery baseline local
c62f0d9	local-fake-extension	45	1.0000	1.0000	1.0000	1.0000	1.49	0.003	0.007	0.0000	0.000	keep	radio recovery local
c62f0d9	real-chrome-extension-smoke	40	1.0000	1.0000	1.0000	1.0000	1.38	0.007	0.015	0.0000	0.000	keep	radio recovery real smoke
c62f0d9	real-chrome-extension-agent	45	1.0000	1.0000	1.0000	1.0000	1.49	0.007	4.120	0.0000	0.001	keep	radio recovery real agent
e5373ab	local-fake-extension	45	1.0000	1.0000	1.0000	1.0000	1.49	0.003	0.008	0.0000	0.000	baseline	semantic settings recovery baseline local
e5373ab	local-fake-extension	46	1.0000	1.0000	1.0000	1.0000	1.52	0.003	0.006	0.0000	0.000	keep	semantic settings recovery local
e5373ab	real-chrome-extension-smoke	41	1.0000	1.0000	1.0000	1.0000	1.41	0.007	0.015	0.0000	0.000	keep	semantic settings recovery real smoke
e5373ab	real-chrome-extension-agent	46	1.0000	1.0000	1.0000	1.0000	1.52	0.007	4.192	0.0000	0.001	keep	semantic settings recovery real agent
f735b80	local-fake-extension	46	1.0000	1.0000	1.0000	1.0000	1.52	0.003	0.007	0.0000	0.000	baseline	starter scoped read baseline local
f735b80	local-fake-extension	47	1.0000	1.0000	1.0000	1.0000	1.51	0.003	0.005	0.0000	0.000	keep	starter scoped read local
f735b80	real-chrome-extension-smoke	42	1.0000	1.0000	1.0000	1.0000	1.40	0.007	0.017	0.0000	0.000	keep	starter scoped read real smoke
f735b80	real-chrome-extension-agent	47	1.0000	1.0000	1.0000	1.0000	1.51	0.008	4.159	0.0000	0.001	keep	starter scoped read real agent
67c5b8e	local-fake-extension	47	1.0000	1.0000	1.0000	1.0000	1.51	0.003	0.007	0.0000	0.000	baseline	starter scoped html baseline local
67c5b8e	local-fake-extension	48	1.0000	1.0000	1.0000	1.0000	1.50	0.003	0.006	0.0000	0.000	keep	starter scoped html local
67c5b8e	real-chrome-extension-smoke	43	1.0000	1.0000	1.0000	1.0000	1.40	0.006	0.014	0.0000	0.000	keep	starter scoped html real smoke
67c5b8e	real-chrome-extension-agent	48	1.0000	1.0000	1.0000	1.0000	1.50	0.007	4.183	0.0000	0.001	keep	starter scoped html real agent
4df2e8f	local-fake-extension	48	1.0000	1.0000	1.0000	1.0000	1.50	0.003	0.006	0.0000	0.000	baseline	starter scoped extract baseline local
4df2e8f	local-fake-extension	49	1.0000	1.0000	1.0000	1.0000	1.53	0.003	0.006	0.0000	0.000	keep	starter scoped extract local
4df2e8f	real-chrome-extension-smoke	43	1.0000	1.0000	1.0000	1.0000	1.40	0.007	0.014	0.0000	0.000	keep	starter scoped extract real smoke
4df2e8f	real-chrome-extension-agent	49	1.0000	1.0000	1.0000	1.0000	1.53	0.007	4.845	0.0000	0.001	keep	starter scoped extract real agent
11f2644	local-fake-extension	49	1.0000	1.0000	1.0000	1.0000	1.53	0.003	0.007	0.0000	0.000	baseline	select selected readback baseline local
11f2644	local-fake-extension	50	1.0000	1.0000	1.0000	1.0000	1.52	0.003	0.006	0.0000	0.000	keep	select selected readback local
11f2644	real-chrome-extension-smoke	44	1.0000	1.0000	1.0000	1.0000	1.39	0.007	0.015	0.0000	0.000	keep	select selected readback real smoke
11f2644	real-chrome-extension-agent	50	1.0000	1.0000	1.0000	1.0000	1.52	0.007	4.903	0.0000	0.001	keep	select selected readback real agent
e8a1f21	local-fake-extension	50	1.0000	1.0000	1.0000	1.0000	1.52	0.003	0.006	0.0000	0.000	baseline	select recovery baseline local
e8a1f21	local-fake-extension	51	1.0000	1.0000	1.0000	1.0000	1.55	0.003	0.006	0.0000	0.000	keep	select recovery local
e8a1f21	real-chrome-extension-smoke	45	1.0000	1.0000	1.0000	1.0000	1.42	0.006	0.014	0.0000	0.000	keep	select recovery real smoke
e8a1f21	real-chrome-extension-agent	51	1.0000	1.0000	1.0000	1.0000	1.55	0.007	4.873	0.0000	0.001	keep	select recovery real agent
90c6287	local-fake-extension	51	1.0000	1.0000	1.0000	1.0000	1.55	0.003	0.005	0.0000	0.000	baseline	select recovered readback baseline local
90c6287	local-fake-extension	52	1.0000	1.0000	1.0000	1.0000	1.54	0.003	0.005	0.0000	0.000	keep	select recovered readback local
90c6287	real-chrome-extension-smoke	46	1.0000	1.0000	1.0000	1.0000	1.41	0.007	0.016	0.0000	0.000	keep	select recovered readback real smoke
90c6287	real-chrome-extension-agent	52	1.0000	1.0000	1.0000	1.0000	1.54	0.007	4.881	0.0000	0.001	keep	select recovered readback real agent
7a0754f	local-fake-extension	52	1.0000	1.0000	1.0000	1.0000	1.54	0.003	0.005	0.0000	0.000	baseline	navigation scroll target read baseline local
7a0754f	local-fake-extension	53	1.0000	1.0000	1.0000	1.0000	1.53	0.003	0.006	0.0000	0.000	keep	navigation scroll target read local
7a0754f	real-chrome-extension-smoke	47	1.0000	1.0000	1.0000	1.0000	1.40	0.007	0.018	0.0000	0.000	keep	navigation scroll target read real smoke
7a0754f	real-chrome-extension-agent	53	0.9811	0.9811	1.0000	1.0000	1.48	0.007	4.866	0.0000	0.001	discard	navigation scroll target read real agent
7a0754f	real-chrome-extension-agent	53	1.0000	1.0000	1.0000	1.0000	1.53	0.006	4.850	0.0000	0.001	keep	navigation scroll target read real agent retry
762400a	local-fake-extension	53	1.0000	1.0000	1.0000	1.0000	1.53	0.003	0.006	0.0000	0.000	baseline	navigation billing link read baseline local
762400a	local-fake-extension	54	1.0000	1.0000	1.0000	1.0000	1.52	0.003	0.006	0.0000	0.000	keep	navigation billing link read local
762400a	real-chrome-extension-smoke	48	1.0000	1.0000	1.0000	1.0000	1.40	0.007	0.017	0.0000	0.000	keep	navigation billing link read real smoke
762400a	real-chrome-extension-agent	54	1.0000	1.0000	1.0000	1.0000	1.52	0.007	4.799	0.0000	0.001	keep	navigation billing link read real agent
aa90f83	local-fake-extension	54	1.0000	1.0000	1.0000	1.0000	1.52	0.003	0.006	0.0000	0.000	baseline	navigation settings link read baseline local
aa90f83	local-fake-extension	55	1.0000	1.0000	1.0000	1.0000	1.51	0.003	0.006	0.0000	0.000	keep	navigation settings link read local
aa90f83	real-chrome-extension-smoke	49	1.0000	1.0000	1.0000	1.0000	1.39	0.007	0.017	0.0000	0.000	keep	navigation settings link read real smoke
aa90f83	real-chrome-extension-agent	55	1.0000	1.0000	1.0000	1.0000	1.51	0.007	4.822	0.0000	0.001	keep	navigation settings link read real agent
d19ceba	local-fake-extension	55	1.0000	1.0000	1.0000	1.0000	1.51	0.003	0.006	0.0000	0.000	baseline	transfer email readback baseline local
d19ceba	local-fake-extension	56	1.0000	1.0000	1.0000	1.0000	1.50	0.003	0.006	0.0000	0.000	keep	transfer email readback local
d19ceba	real-chrome-extension-smoke	50	1.0000	1.0000	1.0000	1.0000	1.38	0.007	0.016	0.0000	0.000	keep	transfer email readback real smoke
d19ceba	real-chrome-extension-agent	56	1.0000	1.0000	1.0000	1.0000	1.50	0.007	4.844	0.0000	0.001	keep	transfer email readback real agent
693b575	local-fake-extension	56	1.0000	1.0000	1.0000	1.0000	1.50	0.003	0.007	0.0000	0.000	baseline	transfer name readback baseline local
693b575	local-fake-extension	57	1.0000	1.0000	1.0000	1.0000	1.49	0.003	0.006	0.0000	0.000	keep	transfer name readback local
693b575	real-chrome-extension-smoke	51	1.0000	1.0000	1.0000	1.0000	1.37	0.007	0.017	0.0000	0.000	keep	transfer name readback real smoke
693b575	real-chrome-extension-agent	57	1.0000	1.0000	1.0000	1.0000	1.49	0.006	4.833	0.0000	0.001	keep	transfer name readback real agent
66461d4	local-fake-extension	57	1.0000	1.0000	1.0000	1.0000	1.49	0.003	0.006	0.0000	0.000	baseline	transfer save result readback baseline local
66461d4	local-fake-extension	58	1.0000	1.0000	1.0000	1.0000	1.48	0.003	0.006	0.0000	0.000	keep	transfer save result readback local
66461d4	real-chrome-extension-smoke	52	1.0000	1.0000	1.0000	1.0000	1.37	0.007	0.014	0.0000	0.000	keep	transfer save result readback real smoke
66461d4	real-chrome-extension-agent	58	1.0000	1.0000	1.0000	1.0000	1.48	0.008	4.817	0.0000	0.001	keep	transfer save result readback real agent
8f51504	local-fake-extension	58	1.0000	1.0000	1.0000	1.0000	1.48	0.003	0.007	0.0000	0.000	baseline	transfer body readback baseline local
8f51504	local-fake-extension	59	1.0000	1.0000	1.0000	1.0000	1.47	0.003	0.006	0.0000	0.000	keep	transfer body readback local
8f51504	real-chrome-extension-smoke	53	1.0000	1.0000	1.0000	1.0000	1.36	0.007	0.016	0.0000	0.000	keep	transfer body readback real smoke
8f51504	real-chrome-extension-agent	59	1.0000	1.0000	1.0000	1.0000	1.47	0.007	4.825	0.0000	0.001	keep	transfer body readback real agent
414b96b	local-fake-extension	59	1.0000	1.0000	1.0000	1.0000	1.47	0.003	0.006	0.0000	0.000	baseline	semantic receipt read baseline local
414b96b	local-fake-extension	60	1.0000	1.0000	1.0000	1.0000	1.47	0.003	0.006	0.0000	0.000	keep	semantic receipt read local
414b96b	real-chrome-extension-smoke	54	1.0000	1.0000	1.0000	1.0000	1.35	0.007	0.017	0.0000	0.000	keep	semantic receipt read real smoke
414b96b	real-chrome-extension-agent	60	1.0000	1.0000	1.0000	1.0000	1.47	0.007	4.097	0.0000	0.001	keep	semantic receipt read real agent
1b4d700	local-fake-extension	60	1.0000	1.0000	1.0000	1.0000	1.47	0.003	0.005	0.0000	0.000	baseline	semantic settings read baseline local
1b4d700	local-fake-extension	61	0.9836	0.9836	1.0000	1.0000	1.47	0.003	0.007	0.0000	0.000	discard	semantic settings read local
1b4d700	local-fake-extension	61	0.9836	0.9836	1.0000	1.0000	1.47	0.003	0.006	0.0000	0.000	discard	semantic settings read before click local
1b4d700	local-fake-extension	61	1.0000	1.0000	1.0000	1.0000	1.46	0.003	0.006	0.0000	0.000	keep	semantic settings read harness parity local
1b4d700	real-chrome-extension-smoke	55	1.0000	1.0000	1.0000	1.0000	1.35	0.007	0.016	0.0000	0.000	keep	semantic settings read real smoke
1b4d700	real-chrome-extension-agent	61	1.0000	1.0000	1.0000	1.0000	1.46	0.007	4.179	0.0000	0.001	keep	semantic settings read real agent
cfb08a8	local-fake-extension	61	1.0000	1.0000	1.0000	1.0000	1.46	0.003	0.006	0.0000	0.000	baseline	semantic invoice read baseline local
cfb08a8	local-fake-extension	62	1.0000	1.0000	1.0000	1.0000	1.45	0.003	0.007	0.0000	0.000	keep	semantic invoice read local
cfb08a8	real-chrome-extension-smoke	56	1.0000	1.0000	1.0000	1.0000	1.34	0.008	0.016	0.0000	0.000	keep	semantic invoice read real smoke
cfb08a8	real-chrome-extension-agent	62	1.0000	1.0000	1.0000	1.0000	1.45	0.007	4.164	0.0000	0.001	keep	semantic invoice read real agent
fd87850	local-fake-extension	62	1.0000	1.0000	1.0000	1.0000	1.45	0.003	0.005	0.0000	0.000	baseline	semantic settings act baseline local
fd87850	local-fake-extension	63	1.0000	1.0000	1.0000	1.0000	1.44	0.003	0.006	0.0000	0.000	keep	semantic settings act local
fd87850	real-chrome-extension-smoke	57	1.0000	1.0000	1.0000	1.0000	1.33	0.006	0.015	0.0000	0.000	keep	semantic settings act real smoke
fd87850	real-chrome-extension-agent	63	1.0000	1.0000	1.0000	1.0000	1.44	0.007	4.173	0.0000	0.001	keep	semantic settings act real agent
c65cdee	local-fake-extension	63	1.0000	1.0000	1.0000	1.0000	1.44	0.003	0.005	0.0000	0.000	baseline	semantic invoice act baseline local
c65cdee	local-fake-extension	64	1.0000	1.0000	1.0000	1.0000	1.44	0.003	0.006	0.0000	0.000	keep	semantic invoice act local
c65cdee	real-chrome-extension-smoke	58	1.0000	1.0000	1.0000	1.0000	1.33	0.007	0.016	0.0000	0.000	keep	semantic invoice act real smoke
c65cdee	real-chrome-extension-agent	64	1.0000	1.0000	1.0000	1.0000	1.44	0.007	4.148	0.0000	0.001	keep	semantic invoice act real agent
abb6b42	local-fake-extension	64	1.0000	1.0000	1.0000	1.0000	1.44	0.003	0.005	0.0000	0.000	baseline	semantic invoice recovery baseline local
abb6b42	local-fake-extension	65	1.0000	1.0000	1.0000	1.0000	1.46	0.003	0.007	0.0000	0.000	keep	semantic invoice recovery local
abb6b42	real-chrome-extension-smoke	59	1.0000	1.0000	1.0000	1.0000	1.36	0.006	0.016	0.0000	0.000	keep	semantic invoice recovery real smoke
abb6b42	real-chrome-extension-agent	65	1.0000	1.0000	1.0000	1.0000	1.46	0.007	4.150	0.0000	0.001	keep	semantic invoice recovery real agent
b148f96	local-fake-extension	65	1.0000	1.0000	1.0000	1.0000	1.46	0.003	0.005	0.0000	0.000	baseline	semantic invoice rerank baseline local
b148f96	local-fake-extension	66	0.9848	0.9848	1.0000	1.0000	1.46	0.003	0.006	0.0000	0.000	discard	semantic invoice rerank local
b148f96	local-fake-extension	66	1.0000	1.0000	1.0000	1.0000	1.44	0.003	0.006	0.0000	0.000	keep	semantic invoice rerank local
b148f96	real-chrome-extension-smoke	60	1.0000	1.0000	1.0000	1.0000	1.33	0.006	0.011	0.0000	0.000	keep	semantic invoice rerank real smoke
b148f96	real-chrome-extension-agent	66	1.0000	1.0000	1.0000	1.0000	1.44	0.007	4.111	0.0000	0.001	keep	semantic invoice rerank real agent
8a5d5a8	local-fake-extension	66	1.0000	1.0000	1.0000	1.0000	1.44	0.003	0.005	0.0000	0.000	baseline	semantic settings rerank baseline local
8a5d5a8	local-fake-extension	67	1.0000	1.0000	1.0000	1.0000	1.42	0.003	0.006	0.0000	0.000	keep	semantic settings rerank local
8a5d5a8	real-chrome-extension-smoke	61	1.0000	1.0000	1.0000	1.0000	1.31	0.007	0.014	0.0000	0.000	keep	semantic settings rerank real smoke
8a5d5a8	real-chrome-extension-agent	67	1.0000	1.0000	1.0000	1.0000	1.42	0.007	4.176	0.0000	0.001	keep	semantic settings rerank real agent
013cf7b	local-fake-extension	67	1.0000	1.0000	1.0000	1.0000	1.42	0.003	0.005	0.0000	0.000	baseline	semantic invoice observe baseline local
013cf7b	local-fake-extension	68	1.0000	1.0000	1.0000	1.0000	1.43	0.003	0.005	0.0000	0.000	keep	semantic invoice observe local
013cf7b	real-chrome-extension-smoke	61	1.0000	1.0000	1.0000	1.0000	1.31	0.006	0.011	0.0000	0.000	keep	semantic invoice observe real smoke
013cf7b	real-chrome-extension-smoke	61	1.0000	1.0000	1.0000	1.0000	1.31	0.006	0.012	0.0000	0.000	keep	semantic invoice observe real smoke
013cf7b	real-chrome-extension-agent	68	1.0000	1.0000	1.0000	1.0000	1.43	0.007	4.211	0.0000	0.001	keep	semantic invoice observe real agent
acf1e9d	local-fake-extension	68	1.0000	1.0000	1.0000	1.0000	1.43	0.003	0.006	0.0000	0.000	baseline	semantic settings observe baseline local
acf1e9d	local-fake-extension	69	1.0000	1.0000	1.0000	1.0000	1.43	0.003	0.005	0.0000	0.000	keep	semantic settings observe local
acf1e9d	real-chrome-extension-smoke	61	1.0000	1.0000	1.0000	1.0000	1.31	0.007	0.011	0.0000	0.000	keep	semantic settings observe real smoke
acf1e9d	real-chrome-extension-agent	69	1.0000	1.0000	1.0000	1.0000	1.43	0.007	4.213	0.0000	0.001	keep	semantic settings observe real agent
66e51d4	local-fake-extension	69	1.0000	1.0000	1.0000	1.0000	1.43	0.003	0.005	0.0000	0.000	baseline	semantic invoice agent baseline local
66e51d4	local-fake-extension	70	0.9857	0.9857	1.0000	1.0000	1.43	0.003	0.005	0.0000	0.000	discard	semantic invoice agent local
66e51d4	local-fake-extension	70	1.0000	1.0000	1.0000	1.0000	1.46	0.003	0.006	0.0000	0.000	keep	semantic invoice agent local
66e51d4	real-chrome-extension-smoke	61	1.0000	1.0000	1.0000	1.0000	1.31	0.007	0.011	0.0000	0.000	keep	semantic invoice agent real smoke
66e51d4	real-chrome-extension-agent	70	1.0000	1.0000	1.0000	1.0000	1.47	0.007	4.875	0.0000	0.001	keep	semantic invoice agent real agent
2386051	local-fake-extension	70	1.0000	1.0000	1.0000	1.0000	1.46	0.003	0.005	0.0000	0.000	baseline	semantic settings agent baseline local
2386051	local-fake-extension	71	1.0000	1.0000	1.0000	1.0000	1.48	0.003	0.006	0.0000	0.000	keep	semantic settings agent local
2386051	real-chrome-extension-smoke	61	1.0000	1.0000	1.0000	1.0000	1.31	0.007	0.014	0.0000	0.000	keep	semantic settings agent real smoke
2386051	real-chrome-extension-agent	71	0.9859	0.9859	1.0000	1.0000	1.47	0.007	4.832	0.0000	0.001	discard	semantic settings agent real agent
2386051	real-chrome-extension-agent	71	0.9859	0.9859	1.0000	1.0000	1.47	0.007	4.931	0.0000	0.001	discard	semantic settings agent real agent
2386051	local-fake-extension	71	1.0000	1.0000	1.0000	1.0000	1.48	0.003	0.006	0.0000	0.000	keep	semantic settings agent retry local
2386051	real-chrome-extension-agent	71	0.9859	0.9859	1.0000	1.0000	1.47	0.007	4.952	0.0000	0.001	discard	semantic settings agent retry real agent
2386051	local-fake-extension	71	1.0000	1.0000	1.0000	1.0000	1.48	0.003	0.006	0.0000	0.000	keep	semantic settings agent fallback local
2386051	real-chrome-extension-agent	71	0.9859	0.9859	1.0000	1.0000	1.47	0.007	4.926	0.0000	0.001	discard	semantic settings agent fallback real agent
2386051	local-fake-extension	71	1.0000	1.0000	1.0000	1.0000	1.48	0.003	0.005	0.0000	0.000	keep	semantic settings agent fallback local
2386051	real-chrome-extension-agent	71	1.0000	1.0000	1.0000	1.0000	1.51	0.007	4.883	0.0000	0.001	keep	semantic settings agent fallback real agent
2386051	real-chrome-extension-smoke	61	1.0000	1.0000	1.0000	1.0000	1.31	0.007	0.015	0.0000	0.000	keep	semantic settings agent fallback real smoke
2386051	real-chrome-extension-agent	71	1.0000	1.0000	1.0000	1.0000	1.51	0.008	4.919	0.0000	0.001	keep	semantic settings agent fallback real agent
288857f	local-fake-extension	71	1.0000	1.0000	1.0000	1.0000	1.48	0.003	0.006	0.0000	0.000	baseline	semantic settings invoice-id rank baseline local
288857f	local-fake-extension	72	1.0000	1.0000	1.0000	1.0000	1.46	0.003	0.006	0.0000	0.000	keep	semantic settings invoice-id rank local
288857f	real-chrome-extension-smoke	62	1.0000	1.0000	1.0000	1.0000	1.29	0.007	0.013	0.0000	0.000	keep	semantic settings invoice-id rank real smoke
288857f	real-chrome-extension-agent	72	1.0000	1.0000	1.0000	1.0000	1.49	0.007	4.924	0.0000	0.001	keep	semantic settings invoice-id rank real agent
ba8a167	local-fake-extension	72	1.0000	1.0000	1.0000	1.0000	1.46	0.003	0.006	0.0000	0.000	baseline	navigation billing click baseline local
ba8a167	local-fake-extension	73	1.0000	1.0000	1.0000	1.0000	1.45	0.003	0.005	0.0000	0.000	keep	navigation billing click local
ba8a167	real-chrome-extension-smoke	63	0.9841	0.9841	1.0000	1.0000	1.29	0.007	0.017	0.0000	0.000	discard	navigation billing click real smoke
ba8a167	local-fake-extension	73	1.0000	1.0000	1.0000	1.0000	1.45	0.003	0.006	0.0000	0.000	keep	navigation billing click isolated local
ba8a167	real-chrome-extension-smoke	63	0.9841	0.9841	1.0000	1.0000	1.29	0.007	0.016	0.0000	0.000	discard	navigation billing click isolated real smoke
ba8a167	local-fake-extension	73	1.0000	1.0000	1.0000	1.0000	1.45	0.003	0.006	0.0000	0.000	keep	navigation billing click unique tab local
ba8a167	real-chrome-extension-smoke	63	1.0000	1.0000	1.0000	1.0000	1.29	0.007	0.015	0.0000	0.000	keep	navigation billing click unique tab real smoke
ba8a167	real-chrome-extension-agent	73	1.0000	1.0000	1.0000	1.0000	1.48	0.007	4.813	0.0000	0.001	keep	navigation billing click unique tab real agent
6a2b3b6	local-fake-extension	73	1.0000	1.0000	1.0000	1.0000	1.45	0.003	0.006	0.0000	0.000	baseline	navigation billing tab visibility baseline local
6a2b3b6	local-fake-extension	74	1.0000	1.0000	1.0000	1.0000	1.43	0.003	0.006	0.0000	0.000	keep	navigation billing tab visibility local
6a2b3b6	real-chrome-extension-smoke	64	1.0000	1.0000	1.0000	1.0000	1.27	0.007	0.014	0.0000	0.000	keep	navigation billing tab visibility real smoke
6a2b3b6	real-chrome-extension-agent	74	1.0000	1.0000	1.0000	1.0000	1.46	0.007	4.910	0.0000	0.001	keep	navigation billing tab visibility real agent
a6cd371	local-fake-extension	74	1.0000	1.0000	1.0000	1.0000	1.43	0.003	0.006	0.0000	0.000	baseline	navigation isolated billing read baseline local
a6cd371	local-fake-extension	75	1.0000	1.0000	1.0000	1.0000	1.43	0.003	0.006	0.0000	0.000	keep	navigation isolated billing read local
a6cd371	real-chrome-extension-smoke	65	1.0000	1.0000	1.0000	1.0000	1.26	0.006	0.015	0.0000	0.000	keep	navigation isolated billing read real smoke
a6cd371	real-chrome-extension-agent	75	1.0000	1.0000	1.0000	1.0000	1.45	0.008	4.938	0.0000	0.001	keep	navigation isolated billing read real agent
038b7d9	local-fake-extension	75	1.0000	1.0000	1.0000	1.0000	1.43	0.003	0.006	0.0000	0.000	baseline	navigation active tab activation baseline local
038b7d9	local-fake-extension	76	1.0000	1.0000	1.0000	1.0000	1.41	0.004	0.006	0.0000	0.000	keep	navigation active tab activation local
038b7d9	real-chrome-extension-smoke	66	1.0000	1.0000	1.0000	1.0000	1.24	0.007	0.016	0.0000	0.000	keep	navigation active tab activation real smoke
038b7d9	real-chrome-extension-agent	76	0.9737	0.9737	1.0000	1.0000	1.36	0.008	4.843	0.0000	0.001	discard	navigation active tab activation real agent
038b7d9	local-fake-extension	77	1.0000	1.0000	1.0000	1.0000	1.39	0.003	0.006	0.0000	0.000	keep	navigation active tab activation restored local
038b7d9	real-chrome-extension-smoke	67	1.0000	1.0000	1.0000	1.0000	1.22	0.007	0.019	0.0000	0.000	keep	navigation active tab activation restored real smoke
038b7d9	real-chrome-extension-agent	77	1.0000	1.0000	1.0000	1.0000	1.42	0.007	4.887	0.0000	0.001	keep	navigation active tab activation restored real agent
f295aa8	local-fake-extension	77	1.0000	1.0000	1.0000	1.0000	1.39	0.003	0.006	0.0000	0.000	baseline	navigation screenshot baseline local
f295aa8	local-fake-extension	78	1.0000	1.0000	1.0000	1.0000	1.38	0.003	0.005	0.0000	0.000	keep	navigation screenshot local
