commit	suite	tasks	success_rate	strict_success_rate	json_valid_rate	selector_hit_rate	actions_per_success	p50_s	p95_s	timeout_rate	model_load_s	status	description
096f911	local-fake-extension	146	1.0000	1.0000	1.0000	1.0000	1.30	0.003	0.005	0.0000	0.000	baseline	destination role after transfer read baseline local
096f911	local-fake-extension	147	1.0000	1.0000	1.0000	1.0000	1.30	0.003	0.005	0.0000	0.000	keep	destination role after transfer read local
096f911	real-chrome-extension-smoke	131	1.0000	1.0000	1.0000	1.0000	1.11	0.008	0.126	0.0000	0.000	keep	destination role after transfer read real smoke
096f911	real-chrome-extension-agent	141	1.0000	1.0000	1.0000	1.0000	1.22	0.009	0.600	0.0000	0.001	keep	destination role after transfer read real agent
8a9d019	local-fake-extension	147	1.0000	1.0000	1.0000	1.0000	1.30	0.003	0.005	0.0000	0.000	baseline	destination role after transfer html read baseline local
8a9d019	local-fake-extension	148	1.0000	1.0000	1.0000	1.0000	1.30	0.003	0.005	0.0000	0.000	keep	destination role after transfer html read local
8a9d019	real-chrome-extension-smoke	132	1.0000	1.0000	1.0000	1.0000	1.11	0.009	0.124	0.0000	0.000	keep	destination role after transfer html read real smoke
8a9d019	real-chrome-extension-agent	142	1.0000	1.0000	1.0000	1.0000	1.22	0.008	0.603	0.0000	0.001	keep	destination role after transfer html read real agent
975fdcf	local-fake-extension	148	1.0000	1.0000	1.0000	1.0000	1.30	0.003	0.005	0.0000	0.000	baseline	destination updates after transfer read baseline local
975fdcf	local-fake-extension	149	1.0000	1.0000	1.0000	1.0000	1.30	0.003	0.005	0.0000	0.000	keep	destination updates after transfer read local
975fdcf	real-chrome-extension-smoke	133	1.0000	1.0000	1.0000	1.0000	1.11	0.009	0.126	0.0000	0.000	keep	destination updates after transfer read real smoke
975fdcf	real-chrome-extension-agent	143	1.0000	1.0000	1.0000	1.0000	1.22	0.008	0.602	0.0000	0.001	keep	destination updates after transfer read real agent
a850729	local-fake-extension	149	1.0000	1.0000	1.0000	1.0000	1.30	0.003	0.005	0.0000	0.000	baseline	destination updates after transfer html read baseline local
a850729	local-fake-extension	150	1.0000	1.0000	1.0000	1.0000	1.29	0.003	0.005	0.0000	0.000	keep	destination updates after transfer html read local
a850729	real-chrome-extension-smoke	134	1.0000	1.0000	1.0000	1.0000	1.10	0.008	0.123	0.0000	0.000	keep	destination updates after transfer html read real smoke
a850729	real-chrome-extension-agent	144	1.0000	1.0000	1.0000	1.0000	1.22	0.010	0.604	0.0000	0.001	keep	destination updates after transfer html read real agent
1440fc9	local-fake-extension	150	1.0000	1.0000	1.0000	1.0000	1.29	0.003	0.005	0.0000	0.000	baseline	destination priority after transfer read baseline local
1440fc9	local-fake-extension	151	1.0000	1.0000	1.0000	1.0000	1.29	0.003	0.005	0.0000	0.000	keep	destination priority after transfer read local
1440fc9	real-chrome-extension-smoke	135	1.0000	1.0000	1.0000	1.0000	1.10	0.008	0.123	0.0000	0.000	keep	destination priority after transfer read real smoke
1440fc9	real-chrome-extension-agent	145	1.0000	1.0000	1.0000	1.0000	1.21	0.009	0.601	0.0000	0.001	keep	destination priority after transfer read real agent
c8641ce	local-fake-extension	151	1.0000	1.0000	1.0000	1.0000	1.29	0.002	0.005	0.0000	0.000	baseline	destination priority after transfer html read baseline local
c8641ce	local-fake-extension	152	1.0000	1.0000	1.0000	1.0000	1.29	0.003	0.005	0.0000	0.000	keep	destination priority after transfer html read local
c8641ce	real-chrome-extension-smoke	136	1.0000	1.0000	1.0000	1.0000	1.10	0.008	0.125	0.0000	0.000	keep	destination priority after transfer html read real smoke
c8641ce	real-chrome-extension-agent	146	1.0000	1.0000	1.0000	1.0000	1.21	0.008	0.597	0.0000	0.001	keep	destination priority after transfer html read real agent
90e923e	local-fake-extension	152	1.0000	1.0000	1.0000	1.0000	1.29	0.003	0.005	0.0000	0.000	baseline	destination priority high after transfer read baseline local
90e923e	local-fake-extension	153	1.0000	1.0000	1.0000	1.0000	1.29	0.003	0.005	0.0000	0.000	keep	destination priority high after transfer read local
90e923e	real-chrome-extension-smoke	137	1.0000	1.0000	1.0000	1.0000	1.10	0.008	0.125	0.0000	0.000	keep	destination priority high after transfer read real smoke
90e923e	real-chrome-extension-agent	147	1.0000	1.0000	1.0000	1.0000	1.21	0.009	0.601	0.0000	0.001	keep	destination priority high after transfer read real agent
d111584	local-fake-extension	153	1.0000	1.0000	1.0000	1.0000	1.29	0.003	0.005	0.0000	0.000	baseline	destination priority high after transfer html read baseline local
d111584	local-fake-extension	154	1.0000	1.0000	1.0000	1.0000	1.29	0.003	0.005	0.0000	0.000	keep	destination priority high after transfer html read local
d111584	real-chrome-extension-smoke	138	1.0000	1.0000	1.0000	1.0000	1.10	0.008	0.124	0.0000	0.000	keep	destination priority high after transfer html read real smoke
d111584	real-chrome-extension-agent	148	1.0000	1.0000	1.0000	1.0000	1.21	0.009	0.599	0.0000	0.001	keep	destination priority high after transfer html read real agent
92268b5	local-fake-extension	154	1.0000	1.0000	1.0000	1.0000	1.29	0.003	0.005	0.0000	0.000	baseline	destination notes after transfer read baseline local
92268b5	local-fake-extension	155	1.0000	1.0000	1.0000	1.0000	1.28	0.003	0.005	0.0000	0.000	keep	destination notes after transfer read local
92268b5	real-chrome-extension-smoke	139	1.0000	1.0000	1.0000	1.0000	1.10	0.008	0.124	0.0000	0.000	keep	destination notes after transfer read real smoke
92268b5	real-chrome-extension-agent	149	1.0000	1.0000	1.0000	1.0000	1.21	0.008	0.602	0.0000	0.002	keep	destination notes after transfer read real agent
66f1f16	local-fake-extension	155	1.0000	1.0000	1.0000	1.0000	1.28	0.003	0.005	0.0000	0.000	baseline	destination notes after transfer html read baseline local
66f1f16	local-fake-extension	156	1.0000	1.0000	1.0000	1.0000	1.28	0.003	0.005	0.0000	0.000	keep	destination notes after transfer html read local
66f1f16	real-chrome-extension-smoke	140	1.0000	1.0000	1.0000	1.0000	1.10	0.008	0.124	0.0000	0.000	keep	destination notes after transfer html read real smoke
66f1f16	real-chrome-extension-agent	150	1.0000	1.0000	1.0000	1.0000	1.21	0.009	0.602	0.0000	0.001	keep	destination notes after transfer html read real agent
c92ecf7	local-fake-extension	156	1.0000	1.0000	1.0000	1.0000	1.28	0.003	0.005	0.0000	0.000	baseline	source name after transfer read baseline local
c92ecf7	local-fake-extension	157	1.0000	1.0000	1.0000	1.0000	1.28	0.003	0.005	0.0000	0.000	keep	source name after transfer read local
c92ecf7	real-chrome-extension-smoke	141	1.0000	1.0000	1.0000	1.0000	1.10	0.008	0.123	0.0000	0.000	keep	source name after transfer read real smoke
c92ecf7	real-chrome-extension-agent	151	1.0000	1.0000	1.0000	1.0000	1.21	0.010	0.604	0.0000	0.001	keep	source name after transfer read real agent
13e372c	local-fake-extension	157	1.0000	1.0000	1.0000	1.0000	1.28	0.003	0.005	0.0000	0.000	baseline	source email after transfer read baseline local
13e372c	local-fake-extension	158	1.0000	1.0000	1.0000	1.0000	1.28	0.003	0.005	0.0000	0.000	keep	source email after transfer read local
13e372c	real-chrome-extension-smoke	142	1.0000	1.0000	1.0000	1.0000	1.10	0.008	0.123	0.0000	0.000	keep	source email after transfer read real smoke
13e372c	real-chrome-extension-agent	152	1.0000	1.0000	1.0000	1.0000	1.20	0.009	0.601	0.0000	0.002	keep	source email after transfer read real agent
d511406	local-fake-extension	158	1.0000	1.0000	1.0000	1.0000	1.28	0.003	0.005	0.0000	0.000	baseline	source name after transfer html read baseline local
d511406	local-fake-extension	159	1.0000	1.0000	1.0000	1.0000	1.28	0.003	0.005	0.0000	0.000	keep	source name after transfer html read local
d511406	real-chrome-extension-smoke	143	1.0000	1.0000	1.0000	1.0000	1.10	0.008	0.124	0.0000	0.000	keep	source name after transfer html read real smoke
d511406	real-chrome-extension-agent	153	1.0000	1.0000	1.0000	1.0000	1.20	0.012	0.604	0.0000	0.001	keep	source name after transfer html read real agent
6301b40	local-fake-extension	159	1.0000	1.0000	1.0000	1.0000	1.28	0.003	0.005	0.0000	0.000	baseline	source email after transfer html read baseline local
6301b40	local-fake-extension	160	1.0000	1.0000	1.0000	1.0000	1.27	0.003	0.005	0.0000	0.000	keep	source email after transfer html read local
6301b40	real-chrome-extension-smoke	144	1.0000	1.0000	1.0000	1.0000	1.10	0.008	0.124	0.0000	0.000	keep	source email after transfer html read real smoke
6301b40	real-chrome-extension-agent	154	1.0000	1.0000	1.0000	1.0000	1.20	0.009	0.599	0.0000	0.071	keep	source email after transfer html read real agent
dcb16bf	local-fake-extension	160	1.0000	1.0000	1.0000	1.0000	1.27	0.003	0.005	0.0000	0.000	baseline	source body after transfer html read baseline local
dcb16bf	local-fake-extension	161	1.0000	1.0000	1.0000	1.0000	1.27	0.003	0.005	0.0000	0.000	keep	source body after transfer html read local
dcb16bf	real-chrome-extension-smoke	145	1.0000	1.0000	1.0000	1.0000	1.10	0.008	0.124	0.0000	0.000	keep	source body after transfer html read real smoke
dcb16bf	real-chrome-extension-agent	155	1.0000	1.0000	1.0000	1.0000	1.20	0.009	0.604	0.0000	0.001	keep	source body after transfer html read real agent
c5ea2bf	local-fake-extension	161	1.0000	1.0000	1.0000	1.0000	1.27	0.003	0.005	0.0000	0.000	baseline	source body after transfer text read baseline local
c5ea2bf	local-fake-extension	162	1.0000	1.0000	1.0000	1.0000	1.27	0.003	0.005	0.0000	0.000	keep	source body after transfer text read local
c5ea2bf	real-chrome-extension-smoke	146	1.0000	1.0000	1.0000	1.0000	1.10	0.008	0.123	0.0000	0.000	keep	source body after transfer text read real smoke
c5ea2bf	real-chrome-extension-agent	156	0.9872	0.9872	1.0000	1.0000	1.16	0.008	0.509	0.0064	0.001	discard	source body after transfer text read real agent
c5ea2bf	real-chrome-extension-agent	156	1.0000	1.0000	1.0000	1.0000	1.20	0.008	0.595	0.0000	0.001	keep	source body after transfer text read real agent
2bdd54b	local-fake-extension	162	1.0000	1.0000	1.0000	1.0000	1.27	0.003	0.005	0.0000	0.000	baseline	source body after save click text read baseline local
2bdd54b	local-fake-extension	163	1.0000	1.0000	1.0000	1.0000	1.27	0.003	0.006	0.0000	0.000	keep	source body after save click text read local
2bdd54b	real-chrome-extension-smoke	147	1.0000	1.0000	1.0000	1.0000	1.10	0.010	0.124	0.0000	0.000	keep	source body after save click text read real smoke
2bdd54b	real-chrome-extension-agent	157	1.0000	1.0000	1.0000	1.0000	1.20	0.010	0.599	0.0000	0.001	keep	source body after save click text read real agent
2e64fce	local-fake-extension	163	1.0000	1.0000	1.0000	1.0000	1.27	0.003	0.005	0.0000	0.000	baseline	source body after save click html read baseline local
2e64fce	local-fake-extension	164	1.0000	1.0000	1.0000	1.0000	1.27	0.003	0.005	0.0000	0.000	keep	source body after save click html read local
2e64fce	real-chrome-extension-smoke	148	1.0000	1.0000	1.0000	1.0000	1.09	0.008	0.124	0.0000	0.000	keep	source body after save click html read real smoke
2e64fce	real-chrome-extension-agent	158	1.0000	1.0000	1.0000	1.0000	1.20	0.008	0.596	0.0000	0.001	keep	source body after save click html read real agent
4a3ee8b	local-fake-extension	164	1.0000	1.0000	1.0000	1.0000	1.27	0.002	0.004	0.0000	0.000	baseline	source name after save click read baseline local
4a3ee8b	local-fake-extension	165	1.0000	1.0000	1.0000	1.0000	1.27	0.003	0.005	0.0000	0.000	keep	source name after save click read local
4a3ee8b	real-chrome-extension-smoke	149	1.0000	1.0000	1.0000	1.0000	1.09	0.008	0.124	0.0000	0.000	keep	source name after save click read real smoke
4a3ee8b	real-chrome-extension-agent	159	1.0000	1.0000	1.0000	1.0000	1.19	0.008	0.605	0.0000	0.002	keep	source name after save click read real agent
aef54fd	local-fake-extension	165	1.0000	1.0000	1.0000	1.0000	1.27	0.003	0.005	0.0000	0.000	baseline	source name after save click html read baseline local
aef54fd	local-fake-extension	166	1.0000	1.0000	1.0000	1.0000	1.27	0.002	0.005	0.0000	0.000	keep	source name after save click html read local
aef54fd	real-chrome-extension-smoke	150	1.0000	1.0000	1.0000	1.0000	1.09	0.009	0.124	0.0000	0.000	keep	source name after save click html read real smoke
aef54fd	real-chrome-extension-agent	160	1.0000	1.0000	1.0000	1.0000	1.19	0.009	0.600	0.0000	0.001	keep	source name after save click html read real agent
2f360f3	local-fake-extension	166	1.0000	1.0000	1.0000	1.0000	1.27	0.003	0.005	0.0000	0.000	baseline	source email after save click read baseline local
2f360f3	local-fake-extension	167	1.0000	1.0000	1.0000	1.0000	1.26	0.003	0.004	0.0000	0.000	keep	source email after save click read local
2f360f3	real-chrome-extension-smoke	151	1.0000	1.0000	1.0000	1.0000	1.09	0.008	0.121	0.0000	0.000	keep	source email after save click read real smoke
2f360f3	real-chrome-extension-agent	161	1.0000	1.0000	1.0000	1.0000	1.19	0.008	0.593	0.0000	0.009	keep	source email after save click read real agent
01ae311	local-fake-extension	167	1.0000	1.0000	1.0000	1.0000	1.26	0.003	0.005	0.0000	0.000	baseline	source email after save click html read baseline local
01ae311	local-fake-extension	168	1.0000	1.0000	1.0000	1.0000	1.26	0.003	0.005	0.0000	0.000	keep	source email after save click html read local
01ae311	real-chrome-extension-smoke	152	1.0000	1.0000	1.0000	1.0000	1.09	0.008	0.123	0.0000	0.000	keep	source email after save click html read real smoke
01ae311	real-chrome-extension-agent	162	1.0000	1.0000	1.0000	1.0000	1.19	0.008	0.594	0.0000	0.001	keep	source email after save click html read real agent
5a31529	local-fake-extension	168	1.0000	1.0000	1.0000	1.0000	1.26	0.003	0.004	0.0000	0.000	baseline	destination name after save click read baseline local
5a31529	local-fake-extension	169	1.0000	1.0000	1.0000	1.0000	1.26	0.003	0.005	0.0000	0.000	keep	destination name after save click read local
5a31529	real-chrome-extension-smoke	153	1.0000	1.0000	1.0000	1.0000	1.09	0.008	0.123	0.0000	0.000	keep	destination name after save click read real smoke
5a31529	real-chrome-extension-agent	163	1.0000	1.0000	1.0000	1.0000	1.19	0.009	0.601	0.0000	0.001	keep	destination name after save click read real agent
2f665ec	local-fake-extension	169	1.0000	1.0000	1.0000	1.0000	1.26	0.003	0.004	0.0000	0.000	baseline	destination name after save click html read baseline local
2f665ec	local-fake-extension	170	0.9941	0.9941	1.0000	1.0000	1.26	0.003	0.005	0.0000	0.000	discard	destination name after save click html read local
2f665ec	local-fake-extension	169	1.0000	1.0000	1.0000	1.0000	1.26	0.003	0.005	0.0000	0.000	baseline	destination name after save click html discard restored local
e19f1ef	local-fake-extension	169	1.0000	1.0000	1.0000	1.0000	1.26	0.003	0.005	0.0000	0.000	baseline	destination email after save click read baseline local
e19f1ef	local-fake-extension	170	1.0000	1.0000	1.0000	1.0000	1.26	0.003	0.004	0.0000	0.000	keep	destination email after save click read local
e19f1ef	real-chrome-extension-smoke	154	1.0000	1.0000	1.0000	1.0000	1.09	0.009	0.124	0.0000	0.000	keep	destination email after save click read real smoke
e19f1ef	real-chrome-extension-agent	164	1.0000	1.0000	1.0000	1.0000	1.19	0.008	0.504	0.0000	0.001	keep	destination email after save click read real agent
0083aa2	local-fake-extension	170	1.0000	1.0000	1.0000	1.0000	1.26	0.003	0.005	0.0000	0.000	baseline	destination role after save click read baseline local
0083aa2	local-fake-extension	171	1.0000	1.0000	1.0000	1.0000	1.26	0.003	0.004	0.0000	0.000	keep	destination role after save click read local
0083aa2	real-chrome-extension-smoke	155	1.0000	1.0000	1.0000	1.0000	1.09	0.009	0.123	0.0000	0.000	keep	destination role after save click read real smoke
0083aa2	real-chrome-extension-agent	165	1.0000	1.0000	1.0000	1.0000	1.19	0.008	0.594	0.0000	0.001	keep	destination role after save click read real agent
54db15d	local-fake-extension	171	1.0000	1.0000	1.0000	1.0000	1.26	0.003	0.005	0.0000	0.000	baseline	destination updates after save click read baseline local
54db15d	local-fake-extension	172	0.9942	0.9942	1.0000	1.0000	1.26	0.003	0.005	0.0000	0.000	discard	destination updates after save click read local
54db15d	local-fake-extension	171	1.0000	1.0000	1.0000	1.0000	1.26	0.002	0.004	0.0000	0.000	baseline	destination updates after save click discard restored local
a97b96b	local-fake-extension	171	1.0000	1.0000	1.0000	1.0000	1.26	0.003	0.005	0.0000	0.000	baseline	destination updates checked after save click read baseline local
a97b96b	local-fake-extension	172	0.9942	0.9942	1.0000	1.0000	1.26	0.003	0.005	0.0000	0.000	discard	destination updates checked after save click read local
a97b96b	local-fake-extension	171	1.0000	1.0000	1.0000	1.0000	1.26	0.003	0.005	0.0000	0.000	baseline	destination updates checked after save click discard restored local
a97b96b	local-fake-extension	171	1.0000	1.0000	1.0000	1.0000	1.26	0.003	0.005	0.0000	0.000	baseline	destination updates unchecked after save click read baseline local
a97b96b	local-fake-extension	172	1.0000	1.0000	1.0000	1.0000	1.26	0.003	0.005	0.0000	0.000	keep	destination updates unchecked after save click read local
a97b96b	real-chrome-extension-smoke	156	1.0000	1.0000	1.0000	1.0000	1.09	0.008	0.124	0.0000	0.000	keep	destination updates unchecked after save click read real smoke
a97b96b	real-chrome-extension-agent	166	1.0000	1.0000	1.0000	1.0000	1.19	0.008	0.604	0.0000	0.001	keep	destination updates unchecked after save click read real agent
274f6d0	local-fake-extension	172	1.0000	1.0000	1.0000	1.0000	1.26	0.003	0.005	0.0000	0.000	baseline	destination priority low after save click read baseline local
274f6d0	local-fake-extension	173	1.0000	1.0000	1.0000	1.0000	1.25	0.003	0.005	0.0000	0.000	keep	destination priority low after save click read local
274f6d0	real-chrome-extension-smoke	157	1.0000	1.0000	1.0000	1.0000	1.09	0.008	0.124	0.0000	0.000	keep	destination priority low after save click read real smoke
274f6d0	real-chrome-extension-agent	167	1.0000	1.0000	1.0000	1.0000	1.19	0.008	0.601	0.0000	0.001	keep	destination priority low after save click read real agent
b4e5c1a	local-fake-extension	173	1.0000	1.0000	1.0000	1.0000	1.25	0.003	0.005	0.0000	0.000	baseline	destination priority high after save click read baseline local
b4e5c1a	local-fake-extension	174	1.0000	1.0000	1.0000	1.0000	1.25	0.003	0.005	0.0000	0.000	keep	destination priority high after save click read local
b4e5c1a	real-chrome-extension-smoke	158	1.0000	1.0000	1.0000	1.0000	1.09	0.008	0.124	0.0000	0.000	keep	destination priority high after save click read real smoke
b4e5c1a	real-chrome-extension-agent	168	1.0000	1.0000	1.0000	1.0000	1.18	0.009	0.599	0.0000	0.001	keep	destination priority high after save click read real agent
f89661e	local-fake-extension	174	1.0000	1.0000	1.0000	1.0000	1.25	0.002	0.005	0.0000	0.000	baseline	destination notes after save click read baseline local
f89661e	local-fake-extension	175	1.0000	1.0000	1.0000	1.0000	1.25	0.003	0.005	0.0000	0.000	keep	destination notes after save click read local
f89661e	real-chrome-extension-smoke	159	1.0000	1.0000	1.0000	1.0000	1.09	0.008	0.124	0.0000	0.000	keep	destination notes after save click read real smoke
f89661e	real-chrome-extension-agent	169	1.0000	1.0000	1.0000	1.0000	1.18	0.008	0.595	0.0000	0.001	keep	destination notes after save click read real agent
04c0428	local-fake-extension	175	1.0000	1.0000	1.0000	1.0000	1.25	0.003	0.005	0.0000	0.000	baseline	destination notes after save click html read baseline local
04c0428	local-fake-extension	176	1.0000	1.0000	1.0000	1.0000	1.25	0.003	0.005	0.0000	0.000	keep	destination notes after save click html read local
04c0428	real-chrome-extension-smoke	160	1.0000	1.0000	1.0000	1.0000	1.09	0.008	0.119	0.0000	0.000	keep	destination notes after save click html read real smoke
04c0428	real-chrome-extension-agent	170	1.0000	1.0000	1.0000	1.0000	1.18	0.008	0.502	0.0000	0.001	keep	destination notes after save click html read real agent
a9082ac	local-fake-extension	176	1.0000	1.0000	1.0000	1.0000	1.25	0.003	0.005	0.0000	0.000	baseline	save profile button after save click read baseline local
a9082ac	local-fake-extension	177	1.0000	1.0000	1.0000	1.0000	1.25	0.003	0.005	0.0000	0.000	keep	save profile button after save click read local
a9082ac	real-chrome-extension-smoke	161	1.0000	1.0000	1.0000	1.0000	1.09	0.008	0.122	0.0000	0.000	keep	save profile button after save click read real smoke
a9082ac	real-chrome-extension-agent	171	1.0000	1.0000	1.0000	1.0000	1.18	0.008	0.599	0.0000	0.001	keep	save profile button after save click read real agent
dc2acab	local-fake-extension	177	1.0000	1.0000	1.0000	1.0000	1.25	0.003	0.005	0.0000	0.000	baseline	save profile button after save click html read baseline local
dc2acab	local-fake-extension	178	1.0000	1.0000	1.0000	1.0000	1.25	0.003	0.005	0.0000	0.000	keep	save profile button after save click html read local
dc2acab	real-chrome-extension-smoke	162	1.0000	1.0000	1.0000	1.0000	1.09	0.008	0.120	0.0000	0.000	keep	save profile button after save click html read real smoke
dc2acab	real-chrome-extension-agent	172	1.0000	1.0000	1.0000	1.0000	1.18	0.008	0.505	0.0000	0.001	keep	save profile button after save click html read real agent
b4d7ecf	local-fake-extension	178	1.0000	1.0000	1.0000	1.0000	1.25	0.003	0.005	0.0000	0.000	baseline	destination name after save click html read baseline local
b4d7ecf	local-fake-extension	179	1.0000	1.0000	1.0000	1.0000	1.25	0.003	0.005	0.0000	0.000	keep	destination name after save click html read local
b4d7ecf	real-chrome-extension-smoke	163	1.0000	1.0000	1.0000	1.0000	1.09	0.007	0.122	0.0000	0.000	keep	destination name after save click html read real smoke
b4d7ecf	real-chrome-extension-agent	173	1.0000	1.0000	1.0000	1.0000	1.18	0.008	0.506	0.0000	0.001	keep	destination name after save click html read real agent
2359ce5	local-fake-extension	179	1.0000	1.0000	1.0000	1.0000	1.25	0.003	0.005	0.0000	0.000	baseline	destination email after save click html read baseline local
