commit	suite	tasks	success_rate	strict_success_rate	json_valid_rate	selector_hit_rate	actions_per_success	p50_s	p95_s	timeout_rate	model_load_s	status	description
f295aa8	real-chrome-extension-smoke	68	1.0000	1.0000	1.0000	1.0000	1.22	0.006	0.055	0.0000	0.000	keep	navigation screenshot real smoke
f295aa8	real-chrome-extension-agent	78	0.9744	0.9744	1.0000	1.0000	1.34	0.007	4.904	0.0000	0.001	discard	navigation screenshot real agent
f295aa8	real-chrome-extension-agent	78	1.0000	1.0000	1.0000	1.0000	1.41	0.007	4.886	0.0000	0.001	keep	navigation screenshot real agent retry
9c0dbc2	local-fake-extension	78	1.0000	1.0000	1.0000	1.0000	1.38	0.003	0.005	0.0000	0.000	baseline	navigation isolated page brief baseline local
9c0dbc2	local-fake-extension	79	1.0000	1.0000	1.0000	1.0000	1.39	0.003	0.005	0.0000	0.000	keep	navigation isolated page brief local
9c0dbc2	real-chrome-extension-smoke	69	1.0000	1.0000	1.0000	1.0000	1.23	0.006	0.052	0.0000	0.000	keep	navigation isolated page brief real smoke
9c0dbc2	real-chrome-extension-agent	79	1.0000	1.0000	1.0000	1.0000	1.42	0.007	4.920	0.0000	0.001	keep	navigation isolated page brief real agent
e6e6bde	local-fake-extension	79	1.0000	1.0000	1.0000	1.0000	1.39	0.003	0.005	0.0000	0.000	baseline	extraction page brief baseline local
e6e6bde	local-fake-extension	80	1.0000	1.0000	1.0000	1.0000	1.40	0.003	0.005	0.0000	0.000	keep	extraction page brief local
e6e6bde	real-chrome-extension-smoke	70	1.0000	1.0000	1.0000	1.0000	1.24	0.006	0.037	0.0000	0.000	keep	extraction page brief real smoke
e6e6bde	real-chrome-extension-agent	80	1.0000	1.0000	1.0000	1.0000	1.43	0.007	4.172	0.0000	0.001	keep	extraction page brief real agent
2647ab8	local-fake-extension	80	1.0000	1.0000	1.0000	1.0000	1.40	0.003	0.006	0.0000	0.000	baseline	forms source page brief baseline local
2647ab8	local-fake-extension	81	1.0000	1.0000	1.0000	1.0000	1.41	0.003	0.005	0.0000	0.000	keep	forms source page brief local
2647ab8	real-chrome-extension-smoke	71	1.0000	1.0000	1.0000	1.0000	1.25	0.007	0.023	0.0000	0.000	keep	forms source page brief real smoke
2647ab8	real-chrome-extension-agent	81	1.0000	1.0000	1.0000	1.0000	1.43	0.006	4.213	0.0000	0.001	keep	forms source page brief real agent
9b5c48e	local-fake-extension	81	1.0000	1.0000	1.0000	1.0000	1.41	0.003	0.006	0.0000	0.000	baseline	forms source html read baseline local
9b5c48e	local-fake-extension	82	1.0000	1.0000	1.0000	1.0000	1.40	0.003	0.005	0.0000	0.000	keep	forms source html read local
9b5c48e	real-chrome-extension-smoke	72	1.0000	1.0000	1.0000	1.0000	1.25	0.006	0.049	0.0000	0.000	keep	forms source html read real smoke
9b5c48e	real-chrome-extension-agent	82	1.0000	1.0000	1.0000	1.0000	1.43	0.007	4.248	0.0000	0.001	keep	forms source html read real agent
413e5c5	local-fake-extension	82	1.0000	1.0000	1.0000	1.0000	1.40	0.003	0.005	0.0000	0.000	baseline	extraction pricing html read baseline local
413e5c5	local-fake-extension	83	0.9880	0.9880	1.0000	1.0000	1.40	0.003	0.005	0.0000	0.000	discard	extraction pricing html read local
413e5c5	local-fake-extension	83	0.9880	0.9880	1.0000	1.0000	1.40	0.003	0.005	0.0000	0.000	discard	extraction pricing html read local
413e5c5	local-fake-extension	83	1.0000	1.0000	1.0000	1.0000	1.40	0.003	0.005	0.0000	0.000	keep	extraction pricing html read local
413e5c5	real-chrome-extension-smoke	73	1.0000	1.0000	1.0000	1.0000	1.25	0.006	0.088	0.0000	0.000	keep	extraction pricing html read real smoke
413e5c5	real-chrome-extension-agent	83	1.0000	1.0000	1.0000	1.0000	1.42	0.007	4.209	0.0000	0.001	keep	extraction pricing html read real agent
03883ed	local-fake-extension	83	1.0000	1.0000	1.0000	1.0000	1.40	0.003	0.007	0.0000	0.000	baseline	forms destination html read baseline local
03883ed	local-fake-extension	84	1.0000	1.0000	1.0000	1.0000	1.39	0.003	0.005	0.0000	0.000	keep	forms destination html read local
03883ed	real-chrome-extension-smoke	74	1.0000	1.0000	1.0000	1.0000	1.24	0.006	0.104	0.0000	0.000	keep	forms destination html read real smoke
03883ed	real-chrome-extension-agent	84	1.0000	1.0000	1.0000	1.0000	1.42	0.007	4.137	0.0000	0.001	keep	forms destination html read real agent
af32c9d	local-fake-extension	84	1.0000	1.0000	1.0000	1.0000	1.39	0.003	0.005	0.0000	0.000	baseline	semantic billing html read baseline local
af32c9d	local-fake-extension	85	1.0000	1.0000	1.0000	1.0000	1.39	0.003	0.006	0.0000	0.000	keep	semantic billing html read local
af32c9d	real-chrome-extension-smoke	75	1.0000	1.0000	1.0000	1.0000	1.24	0.006	0.097	0.0000	0.000	keep	semantic billing html read real smoke
af32c9d	real-chrome-extension-agent	85	1.0000	1.0000	1.0000	1.0000	1.41	0.007	4.216	0.0000	0.001	keep	semantic billing html read real agent
f1bb818	local-fake-extension	85	1.0000	1.0000	1.0000	1.0000	1.39	0.003	0.006	0.0000	0.000	baseline	navigation isolated html read baseline local
f1bb818	local-fake-extension	86	1.0000	1.0000	1.0000	1.0000	1.38	0.003	0.005	0.0000	0.000	keep	navigation isolated html read local
f1bb818	real-chrome-extension-smoke	76	1.0000	1.0000	1.0000	1.0000	1.24	0.006	0.027	0.0000	0.000	keep	navigation isolated html read real smoke
f1bb818	real-chrome-extension-agent	86	1.0000	1.0000	1.0000	1.0000	1.41	0.007	4.133	0.0000	0.001	keep	navigation isolated html read real agent
c7d67b1	local-fake-extension	86	1.0000	1.0000	1.0000	1.0000	1.38	0.003	0.006	0.0000	0.000	baseline	navigation body html read baseline local
c7d67b1	local-fake-extension	87	1.0000	1.0000	1.0000	1.0000	1.38	0.003	0.006	0.0000	0.000	keep	navigation body html read local
c7d67b1	real-chrome-extension-smoke	77	1.0000	1.0000	1.0000	1.0000	1.23	0.006	0.102	0.0000	0.000	keep	navigation body html read real smoke
c7d67b1	real-chrome-extension-agent	87	0.9770	0.9770	1.0000	1.0000	1.34	0.006	4.184	0.0000	0.001	discard	navigation body html read real agent
c7d67b1	real-chrome-extension-agent	87	1.0000	1.0000	1.0000	1.0000	1.40	0.007	4.147	0.0000	0.001	keep	navigation body html read real agent retry
af5ac2e	local-fake-extension	87	1.0000	1.0000	1.0000	1.0000	1.38	0.003	0.005	0.0000	0.000	baseline	navigation isolated screenshot baseline local
af5ac2e	local-fake-extension	88	1.0000	1.0000	1.0000	1.0000	1.38	0.003	0.006	0.0000	0.000	keep	navigation isolated screenshot local
af5ac2e	real-chrome-extension-smoke	78	0.9872	0.9872	1.0000	1.0000	1.23	0.006	0.025	0.0000	0.000	discard	navigation isolated screenshot real smoke
af5ac2e	real-chrome-extension-smoke	78	1.0000	1.0000	1.0000	1.0000	1.23	0.007	0.124	0.0000	0.000	keep	navigation isolated screenshot real smoke throttled
af5ac2e	real-chrome-extension-agent	88	0.9773	0.9773	1.0000	1.0000	1.34	0.007	4.199	0.0000	0.001	discard	navigation isolated screenshot real agent throttled
af5ac2e	real-chrome-extension-agent	88	1.0000	1.0000	1.0000	1.0000	1.40	0.007	4.193	0.0000	0.001	keep	navigation isolated screenshot real agent throttled retry
b803408	local-fake-extension	88	1.0000	1.0000	1.0000	1.0000	1.38	0.003	0.005	0.0000	0.000	baseline	navigation isolated active tab baseline local
b803408	local-fake-extension	89	1.0000	1.0000	1.0000	1.0000	1.36	0.003	0.005	0.0000	0.000	keep	navigation isolated active tab local
b803408	real-chrome-extension-smoke	79	1.0000	1.0000	1.0000	1.0000	1.22	0.006	0.121	0.0000	0.000	keep	navigation isolated active tab real smoke
b803408	real-chrome-extension-agent	89	1.0000	1.0000	1.0000	1.0000	1.38	0.007	4.249	0.0000	0.001	keep	navigation isolated active tab real agent
673354e	local-fake-extension	89	1.0000	1.0000	1.0000	1.0000	1.36	0.003	0.005	0.0000	0.000	baseline	pricing screenshot baseline local
673354e	local-fake-extension	90	1.0000	1.0000	1.0000	1.0000	1.36	0.003	0.005	0.0000	0.000	keep	pricing screenshot local
673354e	real-chrome-extension-smoke	80	1.0000	1.0000	1.0000	1.0000	1.21	0.007	0.122	0.0000	0.000	keep	pricing screenshot real smoke
673354e	real-chrome-extension-agent	90	1.0000	1.0000	1.0000	1.0000	1.38	0.006	4.158	0.0000	0.001	keep	pricing screenshot real agent
e1537f7	local-fake-extension	90	1.0000	1.0000	1.0000	1.0000	1.36	0.003	0.005	0.0000	0.000	baseline	source screenshot baseline local
e1537f7	local-fake-extension	91	1.0000	1.0000	1.0000	1.0000	1.35	0.003	0.006	0.0000	0.000	keep	source screenshot local
e1537f7	real-chrome-extension-smoke	81	1.0000	1.0000	1.0000	1.0000	1.21	0.007	0.124	0.0000	0.000	keep	source screenshot real smoke
e1537f7	real-chrome-extension-agent	91	1.0000	1.0000	1.0000	1.0000	1.37	0.007	4.221	0.0000	0.001	keep	source screenshot real agent
36c8a13	local-fake-extension	91	1.0000	1.0000	1.0000	1.0000	1.35	0.003	0.005	0.0000	0.000	baseline	destination screenshot baseline local
36c8a13	local-fake-extension	92	1.0000	1.0000	1.0000	1.0000	1.35	0.002	0.005	0.0000	0.000	keep	destination screenshot local
36c8a13	real-chrome-extension-smoke	82	1.0000	1.0000	1.0000	1.0000	1.21	0.006	0.498	0.0000	0.000	keep	destination screenshot real smoke
36c8a13	real-chrome-extension-agent	92	0.9783	0.9783	1.0000	1.0000	1.31	0.007	4.080	0.0000	0.001	discard	destination screenshot real agent
36c8a13	real-chrome-extension-agent	92	1.0000	1.0000	1.0000	1.0000	1.37	0.007	4.186	0.0000	0.001	keep	destination screenshot real agent retry
1ed4f50	local-fake-extension	92	1.0000	1.0000	1.0000	1.0000	1.35	0.003	0.005	0.0000	0.000	baseline	source active tab baseline local
1ed4f50	local-fake-extension	93	1.0000	1.0000	1.0000	1.0000	1.33	0.003	0.006	0.0000	0.000	keep	source active tab local
1ed4f50	real-chrome-extension-smoke	83	1.0000	1.0000	1.0000	1.0000	1.19	0.006	0.501	0.0000	0.000	keep	source active tab real smoke
1ed4f50	real-chrome-extension-agent	93	0.9785	0.9785	1.0000	1.0000	1.30	0.007	4.141	0.0000	0.001	discard	source active tab real agent
1ed4f50	real-chrome-extension-agent	93	1.0000	1.0000	1.0000	1.0000	1.35	0.007	4.191	0.0000	0.001	keep	source active tab real agent retry
9b71a42	local-fake-extension	93	1.0000	1.0000	1.0000	1.0000	1.33	0.002	0.006	0.0000	0.000	baseline	destination active tab baseline local
9b71a42	local-fake-extension	94	1.0000	1.0000	1.0000	1.0000	1.32	0.003	0.006	0.0000	0.000	keep	destination active tab local
9b71a42	real-chrome-extension-smoke	84	1.0000	1.0000	1.0000	1.0000	1.18	0.006	0.501	0.0000	0.000	keep	destination active tab real smoke
9b71a42	real-chrome-extension-agent	94	1.0000	1.0000	1.0000	1.0000	1.34	0.007	4.184	0.0000	0.001	keep	destination active tab real agent
f0d435f	local-fake-extension	94	1.0000	1.0000	1.0000	1.0000	1.32	0.003	0.006	0.0000	0.000	baseline	pricing active tab baseline local
f0d435f	local-fake-extension	95	1.0000	1.0000	1.0000	1.0000	1.31	0.002	0.005	0.0000	0.000	keep	pricing active tab local
f0d435f	real-chrome-extension-smoke	85	1.0000	1.0000	1.0000	1.0000	1.16	0.007	0.504	0.0000	0.000	keep	pricing active tab real smoke
f0d435f	real-chrome-extension-agent	95	1.0000	1.0000	1.0000	1.0000	1.33	0.008	4.158	0.0000	0.001	keep	pricing active tab real agent
ed19166	local-fake-extension	95	1.0000	1.0000	1.0000	1.0000	1.31	0.003	0.005	0.0000	0.000	baseline	source body text baseline local
ed19166	local-fake-extension	96	1.0000	1.0000	1.0000	1.0000	1.30	0.003	0.005	0.0000	0.000	keep	source body text local
ed19166	real-chrome-extension-smoke	86	1.0000	1.0000	1.0000	1.0000	1.16	0.007	0.502	0.0000	0.000	keep	source body text real smoke
ed19166	real-chrome-extension-agent	96	0.9792	0.9792	1.0000	1.0000	1.27	0.007	4.119	0.0000	0.001	discard	source body text real agent
ed19166	real-chrome-extension-agent	96	1.0000	1.0000	1.0000	1.0000	1.32	0.007	4.189	0.0000	0.001	keep	source body text real agent retry
804a514	local-fake-extension	96	1.0000	1.0000	1.0000	1.0000	1.30	0.003	0.005	0.0000	0.000	baseline	destination body text baseline local
804a514	local-fake-extension	97	1.0000	1.0000	1.0000	1.0000	1.30	0.003	0.006	0.0000	0.000	keep	destination body text local
804a514	real-chrome-extension-smoke	87	1.0000	1.0000	1.0000	1.0000	1.16	0.007	0.548	0.0000	0.000	keep	destination body text real smoke
804a514	real-chrome-extension-agent	97	1.0000	1.0000	1.0000	1.0000	1.32	0.008	4.191	0.0000	0.717	keep	destination body text real agent
845ecbd	local-fake-extension	97	1.0000	1.0000	1.0000	1.0000	1.30	0.003	0.006	0.0000	0.000	baseline	pricing body text baseline local
845ecbd	local-fake-extension	98	1.0000	1.0000	1.0000	1.0000	1.30	0.003	0.006	0.0000	0.000	keep	pricing body text local
845ecbd	real-chrome-extension-smoke	88	1.0000	1.0000	1.0000	1.0000	1.16	0.008	0.547	0.0000	0.000	keep	pricing body text real smoke
845ecbd	real-chrome-extension-agent	98	0.9490	0.9490	1.0000	1.0000	1.33	0.009	5.053	0.0000	0.001	discard	pricing body text real agent
845ecbd	real-chrome-extension-agent	98	1.0000	1.0000	1.0000	1.0000	1.32	0.008	4.281	0.0000	0.001	keep	pricing body text real agent retry
6fa0757	local-fake-extension	98	1.0000	1.0000	1.0000	1.0000	1.30	0.003	0.007	0.0000	0.000	baseline	navigation body text baseline local
6fa0757	local-fake-extension	99	1.0000	1.0000	1.0000	1.0000	1.29	0.003	0.006	0.0000	0.000	keep	navigation body text local
6fa0757	real-chrome-extension-smoke	89	1.0000	1.0000	1.0000	1.0000	1.16	0.008	0.548	0.0000	0.000	keep	navigation body text real smoke
6fa0757	real-chrome-extension-agent	99	0.9495	0.9495	1.0000	1.0000	1.33	0.009	4.450	0.0000	0.001	discard	navigation body text real agent
6fa0757	real-chrome-extension-agent	99	0.9495	0.9495	1.0000	1.0000	1.33	0.008	4.236	0.0000	0.001	discard	navigation body text real agent retry
6fa0757	real-chrome-extension-smoke	89	1.0000	1.0000	1.0000	1.0000	1.16	0.010	0.548	0.0000	0.000	discard	navigation body text screenshot retry real smoke
6fa0757	real-chrome-extension-agent	99	0.9495	0.9495	1.0000	1.0000	1.33	0.008	4.318	0.0000	0.127	discard	navigation body text screenshot retry real agent
6fa0757	real-chrome-extension-agent	99	1.0000	1.0000	1.0000	1.0000	1.31	0.008	4.297	0.0000	178.834	discard	navigation body text fresh profile diagnostic
6fa0757	real-chrome-extension-agent	99	1.0000	1.0000	1.0000	1.0000	1.31	0.009	4.906	0.0000	148.459	keep	navigation body text real agent clean profile
7dc0fcb	local-fake-extension	99	1.0000	1.0000	1.0000	1.0000	1.29	0.003	0.006	0.0000	0.000	baseline	isolated navigation body text baseline local
7dc0fcb	local-fake-extension	100	1.0000	1.0000	1.0000	1.0000	1.29	0.003	0.005	0.0000	0.000	keep	isolated navigation body text local
7dc0fcb	real-chrome-extension-smoke	90	1.0000	1.0000	1.0000	1.0000	1.16	0.008	0.532	0.0000	0.000	keep	isolated navigation body text real smoke
7dc0fcb	real-chrome-extension-agent	100	0.9800	0.9800	1.0000	1.0000	1.26	0.008	0.572	0.0000	0.333	discard	isolated navigation body text real agent
7dc0fcb	real-chrome-extension-agent	100	1.0000	1.0000	1.0000	1.0000	1.31	0.008	4.429	0.0000	0.093	keep	isolated navigation body text real agent retry
28eb4f0	local-fake-extension	100	1.0000	1.0000	1.0000	1.0000	1.29	0.003	0.005	0.0000	0.000	baseline	billing body text baseline local
28eb4f0	local-fake-extension	101	1.0000	1.0000	1.0000	1.0000	1.29	0.003	0.006	0.0000	0.000	keep	billing body text local
28eb4f0	real-chrome-extension-smoke	91	1.0000	1.0000	1.0000	1.0000	1.15	0.010	0.546	0.0000	0.000	keep	billing body text real smoke
28eb4f0	real-chrome-extension-agent	101	0.9802	0.9802	1.0000	1.0000	1.25	0.008	0.570	0.0000	0.002	discard	billing body text real agent
28eb4f0	real-chrome-extension-agent	101	0.9802	0.9802	1.0000	1.0000	1.25	0.007	0.584	0.0000	0.001	discard	billing body text real agent retry
28eb4f0	real-chrome-extension-agent	101	0.9802	0.9802	1.0000	1.0000	1.25	0.009	0.566	0.0000	143.389	discard	billing body text real agent clean profile
28eb4f0	local-fake-extension	101	1.0000	1.0000	1.0000	1.0000	1.29	0.003	0.005	0.0000	0.000	keep	billing body text local with unaligned runtime fallback
28eb4f0	real-chrome-extension-smoke	91	1.0000	1.0000	1.0000	1.0000	1.15	0.008	0.531	0.0000	0.000	keep	billing body text real smoke with unaligned runtime fallback
28eb4f0	real-chrome-extension-agent	101	0.9901	0.9901	1.0000	1.0000	1.28	0.010	0.567	0.0000	0.001	discard	billing body text real agent with unaligned runtime fallback
28eb4f0	real-chrome-extension-agent	101	1.0000	1.0000	1.0000	1.0000	1.31	0.007	0.566	0.0000	0.001	keep	billing body text real agent with deduplicated unaligned runtime fallback
43deab4	local-fake-extension	101	1.0000	1.0000	1.0000	1.0000	1.29	0.003	0.005	0.0000	0.000	baseline	agent runtime fallback benchmark baseline local
43deab4	local-fake-extension	102	1.0000	1.0000	1.0000	1.0000	1.30	0.003	0.006	0.0000	0.000	keep	agent runtime fallback benchmark local
43deab4	real-chrome-extension-smoke	91	1.0000	1.0000	1.0000	1.0000	1.15	0.007	0.548	0.0000	0.000	keep	agent runtime fallback benchmark real smoke
43deab4	real-chrome-extension-agent	101	0.9802	0.9802	1.0000	1.0000	1.25	0.008	0.566	0.0099	0.001	discard	agent runtime fallback benchmark real agent
43deab4	real-chrome-extension-agent	101	1.0000	1.0000	1.0000	1.0000	1.31	0.010	0.565	0.0000	0.001	keep	agent runtime fallback benchmark real agent retry
9563e43	local-fake-extension	102	1.0000	1.0000	1.0000	1.0000	1.30	0.003	0.006	0.0000	0.000	baseline	preclick runtime fallback benchmark baseline local
9563e43	local-fake-extension	103	1.0000	1.0000	1.0000	1.0000	1.33	0.003	0.005	0.0000	0.000	keep	preclick runtime fallback benchmark local
9563e43	real-chrome-extension-smoke	91	1.0000	1.0000	1.0000	1.0000	1.15	0.008	0.532	0.0000	0.000	keep	preclick runtime fallback benchmark real smoke
9563e43	real-chrome-extension-agent	101	1.0000	1.0000	1.0000	1.0000	1.31	0.007	0.564	0.0000	0.001	keep	preclick runtime fallback benchmark real agent
e19c371	local-fake-extension	103	1.0000	1.0000	1.0000	1.0000	1.33	0.003	0.005	0.0000	0.000	baseline	invoice preclick runtime fallback baseline local
e19c371	local-fake-extension	104	0.9904	0.9904	1.0000	1.0000	1.33	0.003	0.005	0.0000	0.000	discard	invoice preclick runtime fallback local
e19c371	local-fake-extension	104	1.0000	1.0000	1.0000	1.0000	1.36	0.003	0.005	0.0000	0.000	keep	invoice preclick runtime fallback local
e19c371	real-chrome-extension-smoke	91	1.0000	1.0000	1.0000	1.0000	1.15	0.007	0.547	0.0000	0.000	keep	invoice preclick runtime fallback real smoke
e19c371	real-chrome-extension-agent	101	1.0000	1.0000	1.0000	1.0000	1.31	0.007	4.130	0.0000	0.001	keep	invoice preclick runtime fallback real agent
a9fffa9	local-fake-extension	104	1.0000	1.0000	1.0000	1.0000	1.36	0.003	0.006	0.0000	0.000	baseline	settings preclick runtime fallback baseline local
a9fffa9	local-fake-extension	105	1.0000	1.0000	1.0000	1.0000	1.38	0.003	0.006	0.0000	0.000	keep	settings preclick runtime fallback local
a9fffa9	real-chrome-extension-smoke	91	1.0000	1.0000	1.0000	1.0000	1.15	0.007	0.548	0.0000	0.000	keep	settings preclick runtime fallback real smoke
a9fffa9	real-chrome-extension-agent	101	1.0000	1.0000	1.0000	1.0000	1.31	0.008	0.566	0.0000	0.001	keep	settings preclick runtime fallback real agent
969c5e7	local-fake-extension	105	1.0000	1.0000	1.0000	1.0000	1.38	0.004	0.006	0.0000	0.000	baseline	invoice afterclick runtime fallback baseline local
969c5e7	local-fake-extension	106	1.0000	1.0000	1.0000	1.0000	1.40	0.003	0.006	0.0000	0.000	keep	invoice afterclick runtime fallback local
969c5e7	real-chrome-extension-smoke	91	1.0000	1.0000	1.0000	1.0000	1.15	0.008	0.548	0.0000	0.000	keep	invoice afterclick runtime fallback real smoke
969c5e7	real-chrome-extension-agent	101	1.0000	1.0000	1.0000	1.0000	1.31	0.009	4.145	0.0000	0.001	keep	invoice afterclick runtime fallback real agent
0efd6ce	local-fake-extension	106	1.0000	1.0000	1.0000	1.0000	1.40	0.003	0.005	0.0000	0.000	baseline	settings afterclick runtime fallback baseline local
0efd6ce	local-fake-extension	107	1.0000	1.0000	1.0000	1.0000	1.41	0.003	0.005	0.0000	0.000	keep	settings afterclick runtime fallback local
0efd6ce	real-chrome-extension-smoke	91	1.0000	1.0000	1.0000	1.0000	1.15	0.008	0.548	0.0000	0.000	keep	settings afterclick runtime fallback real smoke
0efd6ce	real-chrome-extension-agent	101	1.0000	1.0000	1.0000	1.0000	1.31	0.008	0.581	0.0000	0.001	keep	settings afterclick runtime fallback real agent
b35f1a4	local-fake-extension	107	1.0000	1.0000	1.0000	1.0000	1.41	0.003	0.006	0.0000	0.000	baseline	latest kept report baseline local
b35f1a4	local-fake-extension	107	1.0000	1.0000	1.0000	1.0000	1.41	0.003	0.006	0.0000	0.000	keep	latest kept report section local
b35f1a4	real-chrome-extension-smoke	91	1.0000	1.0000	1.0000	1.0000	1.15	0.011	0.548	0.0000	0.000	keep	latest kept report section real smoke
b35f1a4	real-chrome-extension-agent	101	1.0000	1.0000	1.0000	1.0000	1.31	0.013	4.209	0.0000	0.533	keep	latest kept report section real agent
9617c61	local-fake-extension	107	1.0000	1.0000	1.0000	1.0000	1.41	0.003	0.005	0.0000	0.000	baseline	isolated settings link read baseline local
9617c61	local-fake-extension	108	1.0000	1.0000	1.0000	1.0000	1.41	0.003	0.005	0.0000	0.000	keep	isolated settings link read local
9617c61	real-chrome-extension-smoke	92	1.0000	1.0000	1.0000	1.0000	1.15	0.009	0.546	0.0000	0.000	keep	isolated settings link read real smoke
9617c61	real-chrome-extension-agent	102	1.0000	1.0000	1.0000	1.0000	1.30	0.011	4.424	0.0000	0.055	keep	isolated settings link read real agent
926f51e	local-fake-extension	108	1.0000	1.0000	1.0000	1.0000	1.41	0.003	0.005	0.0000	0.000	baseline	isolated scroll target read baseline local
926f51e	local-fake-extension	109	1.0000	1.0000	1.0000	1.0000	1.40	0.003	0.006	0.0000	0.000	keep	isolated scroll target read local
926f51e	real-chrome-extension-smoke	93	1.0000	1.0000	1.0000	1.0000	1.15	0.009	0.501	0.0000	0.000	keep	isolated scroll target read real smoke
926f51e	real-chrome-extension-agent	103	1.0000	1.0000	1.0000	1.0000	1.30	0.009	4.205	0.0000	0.161	keep	isolated scroll target read real agent
f404110	local-fake-extension	109	1.0000	1.0000	1.0000	1.0000	1.40	0.003	0.005	0.0000	0.000	baseline	save profile button read baseline local
f404110	local-fake-extension	110	0.9909	0.9909	1.0000	1.0000	1.40	0.003	0.005	0.0000	0.000	discard	save profile button read local
f404110	local-fake-extension	110	1.0000	1.0000	1.0000	1.0000	1.40	0.003	0.005	0.0000	0.000	keep	save profile button read local
