commit	suite	tasks	success_rate	strict_success_rate	json_valid_rate	selector_hit_rate	actions_per_success	p50_s	p95_s	timeout_rate	model_load_s	status	description
f404110	real-chrome-extension-smoke	94	1.0000	1.0000	1.0000	1.0000	1.15	0.009	0.498	0.0000	0.000	keep	save profile button read real smoke
f404110	real-chrome-extension-agent	104	1.0000	1.0000	1.0000	1.0000	1.30	0.011	4.142	0.0000	0.001	keep	save profile button read real agent
6580021	local-fake-extension	110	1.0000	1.0000	1.0000	1.0000	1.40	0.003	0.005	0.0000	0.000	baseline	save result after click baseline local
6580021	local-fake-extension	111	1.0000	1.0000	1.0000	1.0000	1.40	0.003	0.005	0.0000	0.000	keep	save result after click local
6580021	real-chrome-extension-smoke	95	1.0000	1.0000	1.0000	1.0000	1.15	0.008	0.499	0.0000	0.000	keep	save result after click real smoke
6580021	real-chrome-extension-agent	105	1.0000	1.0000	1.0000	1.0000	1.30	0.014	4.260	0.0000	0.001	keep	save result after click real agent
1b71a98	local-fake-extension	111	1.0000	1.0000	1.0000	1.0000	1.40	0.003	0.005	0.0000	0.000	baseline	empty destination email read baseline local
1b71a98	local-fake-extension	112	1.0000	1.0000	1.0000	1.0000	1.39	0.003	0.005	0.0000	0.000	keep	empty destination email read local
1b71a98	real-chrome-extension-smoke	96	1.0000	1.0000	1.0000	1.0000	1.15	0.009	0.498	0.0000	0.000	keep	empty destination email read real smoke
1b71a98	real-chrome-extension-agent	106	1.0000	1.0000	1.0000	1.0000	1.29	0.009	0.606	0.0000	0.001	keep	empty destination email read real agent
058a00f	local-fake-extension	112	1.0000	1.0000	1.0000	1.0000	1.39	0.003	0.005	0.0000	0.000	baseline	empty destination name read baseline local
058a00f	local-fake-extension	113	1.0000	1.0000	1.0000	1.0000	1.39	0.003	0.006	0.0000	0.000	keep	empty destination name read local
058a00f	real-chrome-extension-smoke	97	1.0000	1.0000	1.0000	1.0000	1.14	0.010	0.500	0.0000	0.000	keep	empty destination name read real smoke
058a00f	real-chrome-extension-agent	107	1.0000	1.0000	1.0000	1.0000	1.29	0.014	4.330	0.0000	0.001	keep	empty destination name read real agent
ee8f664	local-fake-extension	113	1.0000	1.0000	1.0000	1.0000	1.39	0.003	0.005	0.0000	0.000	baseline	empty destination notes read baseline local
ee8f664	local-fake-extension	114	1.0000	1.0000	1.0000	1.0000	1.39	0.003	0.006	0.0000	0.000	keep	empty destination notes read local
ee8f664	real-chrome-extension-smoke	98	1.0000	1.0000	1.0000	1.0000	1.14	0.008	0.499	0.0000	0.000	keep	empty destination notes read real smoke
ee8f664	real-chrome-extension-agent	108	1.0000	1.0000	1.0000	1.0000	1.29	0.009	0.602	0.0000	0.001	keep	empty destination notes read real agent
a32a230	local-fake-extension	114	1.0000	1.0000	1.0000	1.0000	1.39	0.003	0.005	0.0000	0.000	baseline	initial destination role read baseline local
a32a230	local-fake-extension	115	1.0000	1.0000	1.0000	1.0000	1.38	0.003	0.005	0.0000	0.000	keep	initial destination role read local
a32a230	real-chrome-extension-smoke	99	1.0000	1.0000	1.0000	1.0000	1.14	0.009	0.499	0.0000	0.000	keep	initial destination role read real smoke
a32a230	real-chrome-extension-agent	109	1.0000	1.0000	1.0000	1.0000	1.28	0.010	4.288	0.0000	0.002	keep	initial destination role read real agent
2a91539	local-fake-extension	115	1.0000	1.0000	1.0000	1.0000	1.38	0.003	0.005	0.0000	0.000	baseline	initial destination updates read baseline local
2a91539	local-fake-extension	116	1.0000	1.0000	1.0000	1.0000	1.38	0.003	0.005	0.0000	0.000	keep	initial destination updates read local
2a91539	real-chrome-extension-smoke	100	1.0000	1.0000	1.0000	1.0000	1.14	0.008	0.126	0.0000	0.000	keep	initial destination updates read real smoke
2a91539	real-chrome-extension-agent	110	1.0000	1.0000	1.0000	1.0000	1.28	0.010	4.185	0.0000	0.001	keep	initial destination updates read real agent
b449bd5	local-fake-extension	116	1.0000	1.0000	1.0000	1.0000	1.38	0.003	0.005	0.0000	0.000	baseline	initial destination priority high read baseline local
b449bd5	local-fake-extension	117	1.0000	1.0000	1.0000	1.0000	1.38	0.003	0.005	0.0000	0.000	keep	initial destination priority high read local
b449bd5	real-chrome-extension-smoke	101	1.0000	1.0000	1.0000	1.0000	1.14	0.008	0.130	0.0000	0.000	keep	initial destination priority high read real smoke
b449bd5	real-chrome-extension-agent	111	1.0000	1.0000	1.0000	1.0000	1.28	0.008	4.189	0.0000	0.012	keep	initial destination priority high read real agent
f8df568	local-fake-extension	117	1.0000	1.0000	1.0000	1.0000	1.38	0.003	0.005	0.0000	0.000	baseline	initial destination priority low read baseline local
f8df568	local-fake-extension	118	1.0000	1.0000	1.0000	1.0000	1.37	0.003	0.005	0.0000	0.000	keep	initial destination priority low read local
f8df568	real-chrome-extension-smoke	102	1.0000	1.0000	1.0000	1.0000	1.14	0.009	0.125	0.0000	0.000	keep	initial destination priority low read real smoke
f8df568	real-chrome-extension-agent	112	1.0000	1.0000	1.0000	1.0000	1.28	0.008	4.228	0.0000	0.001	keep	initial destination priority low read real agent
bf95884	local-fake-extension	118	1.0000	1.0000	1.0000	1.0000	1.37	0.003	0.005	0.0000	0.000	baseline	empty save result read baseline local
bf95884	local-fake-extension	119	1.0000	1.0000	1.0000	1.0000	1.37	0.003	0.006	0.0000	0.000	keep	empty save result read local
bf95884	real-chrome-extension-smoke	103	1.0000	1.0000	1.0000	1.0000	1.14	0.009	0.124	0.0000	0.000	keep	empty save result read real smoke
bf95884	real-chrome-extension-agent	113	1.0000	1.0000	1.0000	1.0000	1.27	0.009	0.566	0.0000	0.001	keep	empty save result read real agent
d8c1037	local-fake-extension	119	1.0000	1.0000	1.0000	1.0000	1.37	0.003	0.005	0.0000	0.000	baseline	empty save result html read baseline local
d8c1037	local-fake-extension	120	1.0000	1.0000	1.0000	1.0000	1.37	0.003	0.005	0.0000	0.000	keep	empty save result html read local
d8c1037	real-chrome-extension-smoke	104	1.0000	1.0000	1.0000	1.0000	1.13	0.007	0.125	0.0000	0.000	keep	empty save result html read real smoke
d8c1037	real-chrome-extension-agent	114	1.0000	1.0000	1.0000	1.0000	1.27	0.008	4.214	0.0000	0.001	keep	empty save result html read real agent
7e407a9	local-fake-extension	120	1.0000	1.0000	1.0000	1.0000	1.37	0.003	0.005	0.0000	0.000	baseline	save result after click html read baseline local
7e407a9	local-fake-extension	121	0.9917	0.9917	1.0000	1.0000	1.37	0.003	0.005	0.0000	0.000	discard	save result after click html read local
7e407a9	local-fake-extension	121	1.0000	1.0000	1.0000	1.0000	1.36	0.003	0.005	0.0000	0.000	keep	save result after click html read local
7e407a9	real-chrome-extension-smoke	105	0.9905	0.9905	1.0000	1.0000	1.13	0.007	0.125	0.0000	0.000	discard	save result after click html read real smoke
7e407a9	local-fake-extension	121	1.0000	1.0000	1.0000	1.0000	1.36	0.003	0.005	0.0000	0.000	keep	save result after click html read local
7e407a9	real-chrome-extension-smoke	105	1.0000	1.0000	1.0000	1.0000	1.13	0.007	0.129	0.0000	0.000	keep	save result after click html read real smoke
7e407a9	real-chrome-extension-agent	115	1.0000	1.0000	1.0000	1.0000	1.27	0.008	4.142	0.0000	0.001	keep	save result after click html read real agent
51c4827	local-fake-extension	121	1.0000	1.0000	1.0000	1.0000	1.36	0.003	0.006	0.0000	0.000	baseline	save result after transfer html read baseline local
51c4827	local-fake-extension	122	1.0000	1.0000	1.0000	1.0000	1.36	0.003	0.005	0.0000	0.000	keep	save result after transfer html read local
51c4827	real-chrome-extension-smoke	106	1.0000	1.0000	1.0000	1.0000	1.13	0.007	0.124	0.0000	0.000	keep	save result after transfer html read real smoke
51c4827	real-chrome-extension-agent	116	1.0000	1.0000	1.0000	1.0000	1.27	0.007	4.205	0.0000	0.646	keep	save result after transfer html read real agent
6b3c852	local-fake-extension	122	1.0000	1.0000	1.0000	1.0000	1.36	0.003	0.005	0.0000	0.000	baseline	destination body after transfer html read baseline local
6b3c852	local-fake-extension	123	1.0000	1.0000	1.0000	1.0000	1.36	0.003	0.005	0.0000	0.000	keep	destination body after transfer html read local
6b3c852	real-chrome-extension-smoke	107	1.0000	1.0000	1.0000	1.0000	1.13	0.008	0.125	0.0000	0.000	keep	destination body after transfer html read real smoke
6b3c852	real-chrome-extension-agent	117	1.0000	1.0000	1.0000	1.0000	1.26	0.009	3.912	0.0000	0.001	keep	destination body after transfer html read real agent
fb55260	local-fake-extension	123	1.0000	1.0000	1.0000	1.0000	1.36	0.003	0.005	0.0000	0.000	baseline	destination body after click html read baseline local
fb55260	local-fake-extension	124	1.0000	1.0000	1.0000	1.0000	1.35	0.003	0.005	0.0000	0.000	keep	destination body after click html read local
fb55260	real-chrome-extension-smoke	108	1.0000	1.0000	1.0000	1.0000	1.13	0.008	0.130	0.0000	0.000	keep	destination body after click html read real smoke
fb55260	real-chrome-extension-agent	118	1.0000	1.0000	1.0000	1.0000	1.26	0.008	4.172	0.0000	0.001	keep	destination body after click html read real agent
71d56ec	local-fake-extension	124	1.0000	1.0000	1.0000	1.0000	1.35	0.003	0.005	0.0000	0.000	baseline	destination body after click text read baseline local
71d56ec	local-fake-extension	125	1.0000	1.0000	1.0000	1.0000	1.35	0.003	0.005	0.0000	0.000	keep	destination body after click text read local
71d56ec	real-chrome-extension-smoke	109	1.0000	1.0000	1.0000	1.0000	1.13	0.007	0.126	0.0000	0.000	keep	destination body after click text read real smoke
71d56ec	real-chrome-extension-agent	119	1.0000	1.0000	1.0000	1.0000	1.26	0.008	4.128	0.0000	0.001	keep	destination body after click text read real agent
a23cf65	local-fake-extension	125	1.0000	1.0000	1.0000	1.0000	1.35	0.003	0.005	0.0000	0.000	baseline	source name html read baseline local
a23cf65	local-fake-extension	126	1.0000	1.0000	1.0000	1.0000	1.35	0.003	0.005	0.0000	0.000	keep	source name html read local
a23cf65	real-chrome-extension-smoke	110	1.0000	1.0000	1.0000	1.0000	1.13	0.008	0.125	0.0000	0.000	keep	source name html read real smoke
a23cf65	real-chrome-extension-agent	120	1.0000	1.0000	1.0000	1.0000	1.26	0.007	0.604	0.0000	0.001	keep	source name html read real agent
6aa0332	local-fake-extension	126	1.0000	1.0000	1.0000	1.0000	1.35	0.003	0.005	0.0000	0.000	baseline	source email html read baseline local
6aa0332	local-fake-extension	127	1.0000	1.0000	1.0000	1.0000	1.35	0.003	0.005	0.0000	0.000	keep	source email html read local
6aa0332	real-chrome-extension-smoke	111	1.0000	1.0000	1.0000	1.0000	1.13	0.008	0.124	0.0000	0.000	keep	source email html read real smoke
6aa0332	real-chrome-extension-agent	121	1.0000	1.0000	1.0000	1.0000	1.26	0.008	0.601	0.0000	0.059	keep	source email html read real agent
8b334ad	local-fake-extension	127	1.0000	1.0000	1.0000	1.0000	1.35	0.003	0.005	0.0000	0.000	baseline	save profile button html read baseline local
8b334ad	local-fake-extension	128	1.0000	1.0000	1.0000	1.0000	1.34	0.003	0.005	0.0000	0.000	keep	save profile button html read local
8b334ad	real-chrome-extension-smoke	112	1.0000	1.0000	1.0000	1.0000	1.13	0.007	0.125	0.0000	0.000	keep	save profile button html read real smoke
8b334ad	real-chrome-extension-agent	122	1.0000	1.0000	1.0000	1.0000	1.25	0.008	0.605	0.0000	0.001	keep	save profile button html read real agent
b66c034	local-fake-extension	128	1.0000	1.0000	1.0000	1.0000	1.34	0.003	0.005	0.0000	0.000	baseline	empty destination email html read baseline local
b66c034	local-fake-extension	129	1.0000	1.0000	1.0000	1.0000	1.34	0.003	0.005	0.0000	0.000	keep	empty destination email html read local
b66c034	real-chrome-extension-smoke	113	1.0000	1.0000	1.0000	1.0000	1.12	0.008	0.126	0.0000	0.000	keep	empty destination email html read real smoke
b66c034	real-chrome-extension-agent	123	1.0000	1.0000	1.0000	1.0000	1.25	0.008	0.607	0.0000	0.001	keep	empty destination email html read real agent
e10a078	local-fake-extension	129	1.0000	1.0000	1.0000	1.0000	1.34	0.003	0.006	0.0000	0.000	baseline	empty destination name html read baseline local
e10a078	local-fake-extension	130	1.0000	1.0000	1.0000	1.0000	1.34	0.003	0.005	0.0000	0.000	keep	empty destination name html read local
e10a078	real-chrome-extension-smoke	114	1.0000	1.0000	1.0000	1.0000	1.12	0.007	0.125	0.0000	0.000	keep	empty destination name html read real smoke
e10a078	real-chrome-extension-agent	124	1.0000	1.0000	1.0000	1.0000	1.25	0.008	0.606	0.0000	0.001	keep	empty destination name html read real agent
176caf3	local-fake-extension	130	1.0000	1.0000	1.0000	1.0000	1.34	0.003	0.006	0.0000	0.000	baseline	empty destination notes html read baseline local
176caf3	local-fake-extension	131	1.0000	1.0000	1.0000	1.0000	1.34	0.003	0.005	0.0000	0.000	keep	empty destination notes html read local
176caf3	real-chrome-extension-smoke	115	1.0000	1.0000	1.0000	1.0000	1.12	0.008	0.128	0.0000	0.000	keep	empty destination notes html read real smoke
176caf3	real-chrome-extension-agent	125	1.0000	1.0000	1.0000	1.0000	1.25	0.007	0.602	0.0000	0.001	keep	empty destination notes html read real agent
129468e	local-fake-extension	131	1.0000	1.0000	1.0000	1.0000	1.34	0.003	0.005	0.0000	0.000	baseline	destination role html read baseline local
129468e	local-fake-extension	132	0.9924	0.9924	1.0000	1.0000	1.34	0.003	0.006	0.0000	0.000	discard	destination role html read local
129468e	local-fake-extension	132	1.0000	1.0000	1.0000	1.0000	1.33	0.003	0.005	0.0000	0.000	keep	destination role html read local
129468e	real-chrome-extension-smoke	116	1.0000	1.0000	1.0000	1.0000	1.12	0.008	0.125	0.0000	0.000	keep	destination role html read real smoke
129468e	real-chrome-extension-agent	126	1.0000	1.0000	1.0000	1.0000	1.25	0.009	0.603	0.0000	0.001	keep	destination role html read real agent
782e91b	local-fake-extension	132	1.0000	1.0000	1.0000	1.0000	1.33	0.003	0.005	0.0000	0.000	baseline	destination updates checked html read baseline local
782e91b	local-fake-extension	133	1.0000	1.0000	1.0000	1.0000	1.33	0.003	0.005	0.0000	0.000	keep	destination updates checked html read local
782e91b	real-chrome-extension-smoke	117	1.0000	1.0000	1.0000	1.0000	1.12	0.007	0.125	0.0000	0.000	keep	destination updates checked html read real smoke
782e91b	real-chrome-extension-agent	127	1.0000	1.0000	1.0000	1.0000	1.24	0.007	0.606	0.0000	0.001	keep	destination updates checked html read real agent
59f137c	local-fake-extension	133	1.0000	1.0000	1.0000	1.0000	1.33	0.003	0.005	0.0000	0.000	baseline	destination priority high checked html read baseline local
59f137c	local-fake-extension	134	1.0000	1.0000	1.0000	1.0000	1.33	0.004	0.006	0.0000	0.000	keep	destination priority high checked html read local
59f137c	real-chrome-extension-smoke	118	1.0000	1.0000	1.0000	1.0000	1.12	0.009	0.123	0.0000	0.000	keep	destination priority high checked html read real smoke
59f137c	real-chrome-extension-agent	128	1.0000	1.0000	1.0000	1.0000	1.24	0.008	0.604	0.0000	0.001	keep	destination priority high checked html read real agent
0d2cc14	local-fake-extension	134	1.0000	1.0000	1.0000	1.0000	1.33	0.003	0.005	0.0000	0.000	baseline	destination priority low checked html read baseline local
0d2cc14	local-fake-extension	135	1.0000	1.0000	1.0000	1.0000	1.33	0.003	0.005	0.0000	0.000	keep	destination priority low checked html read local
0d2cc14	real-chrome-extension-smoke	119	1.0000	1.0000	1.0000	1.0000	1.12	0.008	0.124	0.0000	0.000	keep	destination priority low checked html read real smoke
0d2cc14	real-chrome-extension-agent	129	1.0000	1.0000	1.0000	1.0000	1.24	0.008	0.605	0.0000	0.001	keep	destination priority low checked html read real agent
ca5e975	local-fake-extension	135	1.0000	1.0000	1.0000	1.0000	1.33	0.003	0.005	0.0000	0.000	baseline	destination priority low unchecked html read baseline local
ca5e975	local-fake-extension	136	1.0000	1.0000	1.0000	1.0000	1.32	0.003	0.005	0.0000	0.000	keep	destination priority low unchecked html read local
ca5e975	real-chrome-extension-smoke	120	1.0000	1.0000	1.0000	1.0000	1.12	0.007	0.124	0.0000	0.000	keep	destination priority low unchecked html read real smoke
ca5e975	real-chrome-extension-agent	130	1.0000	1.0000	1.0000	1.0000	1.24	0.007	0.603	0.0000	0.001	keep	destination priority low unchecked html read real agent
3be5445	local-fake-extension	136	1.0000	1.0000	1.0000	1.0000	1.32	0.003	0.006	0.0000	0.000	baseline	destination priority high unchecked html read baseline local
3be5445	local-fake-extension	137	1.0000	1.0000	1.0000	1.0000	1.32	0.003	0.006	0.0000	0.000	keep	destination priority high unchecked html read local
3be5445	real-chrome-extension-smoke	121	1.0000	1.0000	1.0000	1.0000	1.12	0.009	0.123	0.0000	0.000	keep	destination priority high unchecked html read real smoke
3be5445	real-chrome-extension-agent	131	1.0000	1.0000	1.0000	1.0000	1.24	0.009	0.584	0.0000	0.001	keep	destination priority high unchecked html read real agent
4b7094e	local-fake-extension	137	1.0000	1.0000	1.0000	1.0000	1.32	0.003	0.005	0.0000	0.000	baseline	destination updates unchecked html read baseline local
4b7094e	local-fake-extension	138	1.0000	1.0000	1.0000	1.0000	1.32	0.003	0.005	0.0000	0.000	keep	destination updates unchecked html read local
4b7094e	real-chrome-extension-smoke	122	1.0000	1.0000	1.0000	1.0000	1.11	0.008	0.122	0.0000	0.000	keep	destination updates unchecked html read real smoke
4b7094e	real-chrome-extension-agent	132	1.0000	1.0000	1.0000	1.0000	1.23	0.010	0.566	0.0000	0.001	keep	destination updates unchecked html read real agent
cd5b710	local-fake-extension	138	1.0000	1.0000	1.0000	1.0000	1.32	0.003	0.005	0.0000	0.000	baseline	destination name typed html read baseline local
cd5b710	local-fake-extension	139	1.0000	1.0000	1.0000	1.0000	1.32	0.003	0.005	0.0000	0.000	keep	destination name typed html read local
cd5b710	real-chrome-extension-smoke	123	1.0000	1.0000	1.0000	1.0000	1.11	0.010	0.124	0.0000	0.000	keep	destination name typed html read real smoke
cd5b710	real-chrome-extension-agent	133	1.0000	1.0000	1.0000	1.0000	1.23	0.010	0.565	0.0000	0.001	keep	destination name typed html read real agent
f690d7e	local-fake-extension	139	1.0000	1.0000	1.0000	1.0000	1.32	0.003	0.006	0.0000	0.000	baseline	destination name appended html read baseline local
f690d7e	local-fake-extension	140	1.0000	1.0000	1.0000	1.0000	1.31	0.003	0.005	0.0000	0.000	keep	destination name appended html read local
f690d7e	real-chrome-extension-smoke	124	1.0000	1.0000	1.0000	1.0000	1.11	0.010	0.124	0.0000	0.000	keep	destination name appended html read real smoke
f690d7e	real-chrome-extension-agent	134	1.0000	1.0000	1.0000	1.0000	1.23	0.009	0.581	0.0000	0.001	keep	destination name appended html read real agent
e1465a5	local-fake-extension	140	1.0000	1.0000	1.0000	1.0000	1.31	0.003	0.005	0.0000	0.000	baseline	destination name transfer html read baseline local
e1465a5	local-fake-extension	141	1.0000	1.0000	1.0000	1.0000	1.31	0.003	0.006	0.0000	0.000	keep	destination name transfer html read local
e1465a5	real-chrome-extension-smoke	125	1.0000	1.0000	1.0000	1.0000	1.11	0.009	0.125	0.0000	0.000	keep	destination name transfer html read real smoke
e1465a5	real-chrome-extension-agent	135	1.0000	1.0000	1.0000	1.0000	1.23	0.010	0.577	0.0000	0.001	keep	destination name transfer html read real agent
6f48ddd	local-fake-extension	141	1.0000	1.0000	1.0000	1.0000	1.31	0.003	0.005	0.0000	0.000	baseline	destination email transfer html read baseline local
6f48ddd	local-fake-extension	142	1.0000	1.0000	1.0000	1.0000	1.31	0.003	0.005	0.0000	0.000	keep	destination email transfer html read local
6f48ddd	real-chrome-extension-smoke	126	1.0000	1.0000	1.0000	1.0000	1.11	0.009	0.124	0.0000	0.000	keep	destination email transfer html read real smoke
6f48ddd	real-chrome-extension-agent	136	1.0000	1.0000	1.0000	1.0000	1.23	0.010	0.577	0.0000	0.001	keep	destination email transfer html read real agent
0ebe307	local-fake-extension	142	1.0000	1.0000	1.0000	1.0000	1.31	0.003	0.005	0.0000	0.000	baseline	destination notes typed html read baseline local
0ebe307	local-fake-extension	143	1.0000	1.0000	1.0000	1.0000	1.31	0.003	0.005	0.0000	0.000	keep	destination notes typed html read local
0ebe307	real-chrome-extension-smoke	127	1.0000	1.0000	1.0000	1.0000	1.11	0.011	0.125	0.0000	0.000	keep	destination notes typed html read real smoke
0ebe307	real-chrome-extension-agent	137	1.0000	1.0000	1.0000	1.0000	1.23	0.010	0.558	0.0000	0.001	keep	destination notes typed html read real agent
387b9e2	local-fake-extension	143	1.0000	1.0000	1.0000	1.0000	1.31	0.003	0.005	0.0000	0.000	baseline	destination notes recovered text read baseline local
387b9e2	local-fake-extension	144	1.0000	1.0000	1.0000	1.0000	1.31	0.003	0.005	0.0000	0.000	keep	destination notes recovered text read local
387b9e2	real-chrome-extension-smoke	128	1.0000	1.0000	1.0000	1.0000	1.11	0.009	0.124	0.0000	0.000	keep	destination notes recovered text read real smoke
387b9e2	real-chrome-extension-agent	138	1.0000	1.0000	1.0000	1.0000	1.22	0.009	0.558	0.0000	0.001	keep	destination notes recovered text read real agent
505204c	local-fake-extension	144	1.0000	1.0000	1.0000	1.0000	1.31	0.003	0.005	0.0000	0.000	baseline	destination role recovered html read baseline local
505204c	local-fake-extension	145	1.0000	1.0000	1.0000	1.0000	1.30	0.003	0.005	0.0000	0.000	keep	destination role recovered html read local
505204c	real-chrome-extension-smoke	129	1.0000	1.0000	1.0000	1.0000	1.11	0.007	0.124	0.0000	0.000	keep	destination role recovered html read real smoke
505204c	real-chrome-extension-agent	139	1.0000	1.0000	1.0000	1.0000	1.22	0.009	0.599	0.0000	0.001	keep	destination role recovered html read real agent
687c23a	local-fake-extension	145	1.0000	1.0000	1.0000	1.0000	1.30	0.003	0.005	0.0000	0.000	baseline	destination role selected html read baseline local
687c23a	local-fake-extension	146	1.0000	1.0000	1.0000	1.0000	1.30	0.003	0.004	0.0000	0.000	keep	destination role selected html read local
687c23a	real-chrome-extension-smoke	130	1.0000	1.0000	1.0000	1.0000	1.11	0.009	0.124	0.0000	0.000	keep	destination role selected html read real smoke
687c23a	real-chrome-extension-agent	140	1.0000	1.0000	1.0000	1.0000	1.22	0.008	0.603	0.0000	0.001	keep	destination role selected html read real agent
