commit	suite	tasks	success_rate	strict_success_rate	json_valid_rate	selector_hit_rate	actions_per_success	p50_s	p95_s	timeout_rate	model_load_s	status	description
2359ce5	local-fake-extension	180	1.0000	1.0000	1.0000	1.0000	1.24	0.003	0.006	0.0000	0.000	keep	destination email after save click html read local
2359ce5	real-chrome-extension-smoke	164	1.0000	1.0000	1.0000	1.0000	1.09	0.008	0.123	0.0000	0.000	keep	destination email after save click html read real smoke
2359ce5	real-chrome-extension-agent	174	1.0000	1.0000	1.0000	1.0000	1.18	0.009	0.594	0.0000	0.001	keep	destination email after save click html read real agent
cc1fc42	local-fake-extension	180	1.0000	1.0000	1.0000	1.0000	1.24	0.002	0.005	0.0000	0.000	baseline	destination role after save click html read baseline local
cc1fc42	local-fake-extension	181	1.0000	1.0000	1.0000	1.0000	1.24	0.003	0.005	0.0000	0.000	keep	destination role after save click html read local
cc1fc42	real-chrome-extension-smoke	165	1.0000	1.0000	1.0000	1.0000	1.08	0.008	0.123	0.0000	0.000	keep	destination role after save click html read real smoke
cc1fc42	real-chrome-extension-agent	175	1.0000	1.0000	1.0000	1.0000	1.18	0.010	0.499	0.0000	0.095	keep	destination role after save click html read real agent
4a3a7a1	local-fake-extension	181	1.0000	1.0000	1.0000	1.0000	1.24	0.003	0.005	0.0000	0.000	baseline	destination updates after save click html read baseline local
4a3a7a1	local-fake-extension	182	1.0000	1.0000	1.0000	1.0000	1.24	0.003	0.004	0.0000	0.000	keep	destination updates after save click html read local
4a3a7a1	real-chrome-extension-smoke	166	1.0000	1.0000	1.0000	1.0000	1.08	0.008	0.123	0.0000	0.000	keep	destination updates after save click html read real smoke
4a3a7a1	real-chrome-extension-agent	176	1.0000	1.0000	1.0000	1.0000	1.18	0.008	0.594	0.0000	0.001	keep	destination updates after save click html read real agent
862b847	local-fake-extension	182	1.0000	1.0000	1.0000	1.0000	1.24	0.003	0.004	0.0000	0.000	baseline	destination low priority after save click html read baseline local
862b847	local-fake-extension	183	1.0000	1.0000	1.0000	1.0000	1.24	0.003	0.004	0.0000	0.000	keep	destination low priority after save click html read local
862b847	real-chrome-extension-smoke	167	1.0000	1.0000	1.0000	1.0000	1.08	0.007	0.122	0.0000	0.000	keep	destination low priority after save click html read real smoke
862b847	real-chrome-extension-agent	177	1.0000	1.0000	1.0000	1.0000	1.18	0.008	0.601	0.0000	0.001	keep	destination low priority after save click html read real agent
c2c1918	local-fake-extension	183	1.0000	1.0000	1.0000	1.0000	1.24	0.003	0.004	0.0000	0.000	baseline	destination high priority after save click html read baseline local
c2c1918	local-fake-extension	184	1.0000	1.0000	1.0000	1.0000	1.24	0.003	0.005	0.0000	0.000	keep	destination high priority after save click html read local
c2c1918	real-chrome-extension-smoke	168	1.0000	1.0000	1.0000	1.0000	1.08	0.008	0.123	0.0000	0.000	keep	destination high priority after save click html read real smoke
c2c1918	real-chrome-extension-agent	178	0.9888	0.9888	1.0000	1.0000	1.14	0.009	0.499	0.0000	0.001	discard	destination high priority after save click html read real agent
c2c1918	real-chrome-extension-agent	178	1.0000	1.0000	1.0000	1.0000	1.17	0.009	0.506	0.0000	0.002	keep	destination high priority after save click html read real agent
db23740	local-fake-extension	184	1.0000	1.0000	1.0000	1.0000	1.24	0.003	0.005	0.0000	0.000	baseline	destination updates initial html read baseline local
db23740	local-fake-extension	185	1.0000	1.0000	1.0000	1.0000	1.24	0.003	0.005	0.0000	0.000	keep	destination updates initial html read local
db23740	real-chrome-extension-smoke	169	1.0000	1.0000	1.0000	1.0000	1.08	0.007	0.121	0.0000	0.000	keep	destination updates initial html read real smoke
db23740	real-chrome-extension-agent	179	1.0000	1.0000	1.0000	1.0000	1.17	0.008	0.503	0.0000	0.001	keep	destination updates initial html read real agent
bd42640	local-fake-extension	185	1.0000	1.0000	1.0000	1.0000	1.24	0.003	0.005	0.0000	0.000	baseline	destination high priority initial html read baseline local
bd42640	local-fake-extension	186	1.0000	1.0000	1.0000	1.0000	1.24	0.003	0.005	0.0000	0.000	keep	destination high priority initial html read local
bd42640	real-chrome-extension-smoke	170	1.0000	1.0000	1.0000	1.0000	1.08	0.008	0.114	0.0000	0.000	keep	destination high priority initial html read real smoke
bd42640	real-chrome-extension-agent	180	1.0000	1.0000	1.0000	1.0000	1.17	0.009	0.502	0.0000	0.001	keep	destination high priority initial html read real agent
2bf0037	local-fake-extension	186	1.0000	1.0000	1.0000	1.0000	1.24	0.003	0.005	0.0000	0.000	baseline	destination low priority initial html read baseline local
2bf0037	local-fake-extension	187	1.0000	1.0000	1.0000	1.0000	1.24	0.003	0.005	0.0000	0.000	keep	destination low priority initial html read local
2bf0037	real-chrome-extension-smoke	171	1.0000	1.0000	1.0000	1.0000	1.08	0.008	0.122	0.0000	0.000	keep	destination low priority initial html read real smoke
2bf0037	real-chrome-extension-agent	181	1.0000	1.0000	1.0000	1.0000	1.17	0.009	0.500	0.0000	0.001	keep	destination low priority initial html read real agent
9e87540	local-fake-extension	187	1.0000	1.0000	1.0000	1.0000	1.24	0.002	0.005	0.0000	0.000	baseline	destination notes recovered html read baseline local
9e87540	local-fake-extension	188	1.0000	1.0000	1.0000	1.0000	1.23	0.003	0.005	0.0000	0.000	keep	destination notes recovered html read local
9e87540	real-chrome-extension-smoke	172	1.0000	1.0000	1.0000	1.0000	1.08	0.007	0.120	0.0000	0.000	keep	destination notes recovered html read real smoke
9e87540	real-chrome-extension-agent	182	1.0000	1.0000	1.0000	1.0000	1.17	0.009	0.497	0.0000	0.001	keep	destination notes recovered html read real agent
a85f454	local-fake-extension	188	1.0000	1.0000	1.0000	1.0000	1.23	0.003	0.005	0.0000	0.000	baseline	destination role options html read baseline local
a85f454	local-fake-extension	189	1.0000	1.0000	1.0000	1.0000	1.23	0.003	0.005	0.0000	0.000	keep	destination role options html read local
a85f454	real-chrome-extension-smoke	173	1.0000	1.0000	1.0000	1.0000	1.08	0.010	0.123	0.0000	0.000	keep	destination role options html read real smoke
a85f454	real-chrome-extension-agent	183	1.0000	1.0000	1.0000	1.0000	1.17	0.008	0.501	0.0000	0.001	keep	destination role options html read real agent
d47fc5c	local-fake-extension	189	1.0000	1.0000	1.0000	1.0000	1.23	0.003	0.005	0.0000	0.000	baseline	navigation billing link html read baseline local
d47fc5c	local-fake-extension	190	1.0000	1.0000	1.0000	1.0000	1.23	0.003	0.005	0.0000	0.000	keep	navigation billing link html read local
d47fc5c	real-chrome-extension-smoke	174	1.0000	1.0000	1.0000	1.0000	1.08	0.008	0.123	0.0000	0.000	keep	navigation billing link html read real smoke
d47fc5c	real-chrome-extension-agent	184	1.0000	1.0000	1.0000	1.0000	1.17	0.009	0.503	0.0000	0.001	keep	navigation billing link html read real agent
ff53ec3	local-fake-extension	190	1.0000	1.0000	1.0000	1.0000	1.23	0.003	0.005	0.0000	0.000	baseline	navigation settings link html read baseline local
ff53ec3	local-fake-extension	191	1.0000	1.0000	1.0000	1.0000	1.23	0.003	0.005	0.0000	0.000	keep	navigation settings link html read local
ff53ec3	real-chrome-extension-smoke	175	1.0000	1.0000	1.0000	1.0000	1.08	0.008	0.121	0.0000	0.000	keep	navigation settings link html read real smoke
ff53ec3	real-chrome-extension-agent	185	1.0000	1.0000	1.0000	1.0000	1.17	0.008	0.506	0.0000	0.001	keep	navigation settings link html read real agent
c095dc8	local-fake-extension	191	1.0000	1.0000	1.0000	1.0000	1.23	0.003	0.005	0.0000	0.000	baseline	navigation isolated billing link html read baseline local
c095dc8	local-fake-extension	192	1.0000	1.0000	1.0000	1.0000	1.23	0.003	0.005	0.0000	0.000	keep	navigation isolated billing link html read local
c095dc8	real-chrome-extension-smoke	176	1.0000	1.0000	1.0000	1.0000	1.08	0.008	0.123	0.0000	0.000	keep	navigation isolated billing link html read real smoke
c095dc8	real-chrome-extension-agent	186	1.0000	1.0000	1.0000	1.0000	1.17	0.009	0.496	0.0000	0.001	keep	navigation isolated billing link html read real agent
bc410b5	local-fake-extension	192	1.0000	1.0000	1.0000	1.0000	1.23	0.003	0.005	0.0000	0.000	baseline	navigation isolated settings link html read baseline local
bc410b5	local-fake-extension	193	1.0000	1.0000	1.0000	1.0000	1.23	0.003	0.005	0.0000	0.000	keep	navigation isolated settings link html read local
bc410b5	real-chrome-extension-smoke	177	1.0000	1.0000	1.0000	1.0000	1.08	0.008	0.121	0.0000	0.000	keep	navigation isolated settings link html read real smoke
bc410b5	real-chrome-extension-agent	187	1.0000	1.0000	1.0000	1.0000	1.17	0.009	0.508	0.0000	0.001	keep	navigation isolated settings link html read real agent
85061ea	local-fake-extension	193	1.0000	1.0000	1.0000	1.0000	1.23	0.003	0.006	0.0000	0.000	baseline	semantic receipt button html read baseline local
85061ea	local-fake-extension	194	1.0000	1.0000	1.0000	1.0000	1.23	0.003	0.005	0.0000	0.000	keep	semantic receipt button html read local
85061ea	real-chrome-extension-smoke	178	1.0000	1.0000	1.0000	1.0000	1.08	0.009	0.123	0.0000	0.000	keep	semantic receipt button html read real smoke
85061ea	real-chrome-extension-agent	188	1.0000	1.0000	1.0000	1.0000	1.16	0.008	0.497	0.0000	0.001	keep	semantic receipt button html read real agent
795525a	local-fake-extension	198	1.0000	1.0000	1.0000	1.0000	1.23	0.003	0.005	0.0000	0.000	keep	adversarial duplicate invoice state verification local
795525a	real-chrome-extension-smoke	182	1.0000	1.0000	1.0000	1.0000	1.08	0.009	0.120	0.0000	0.000	keep	adversarial duplicate invoice state verification real smoke
795525a	real-chrome-extension-agent	192	1.0000	1.0000	1.0000	1.0000	1.17	0.009	0.550	0.0000	0.189	keep	adversarial duplicate invoice state verification real agent
16c5cdc	local-fake-extension	198	1.0000	1.0000	1.0000	1.0000	1.23	0.003	0.006	0.0000	0.000	baseline	dynamic ui controls baseline local
16c5cdc	local-fake-extension	207	1.0000	1.0000	1.0000	1.0000	1.22	0.003	0.005	0.0000	0.000	keep	dynamic react controls choose option local
16c5cdc	real-chrome-extension-smoke	191	0.9843	0.9843	1.0000	1.0000	1.09	0.010	0.120	0.0000	0.000	discard	dynamic react controls choose option real smoke
16c5cdc	real-chrome-extension-smoke	191	1.0000	1.0000	1.0000	1.0000	1.08	0.010	0.122	0.0000	0.000	keep	dynamic react controls choose option real smoke
16c5cdc	real-chrome-extension-agent	201	1.0000	1.0000	1.0000	1.0000	1.16	0.011	0.544	0.0000	0.673	keep	dynamic react controls choose option real agent
16c5cdc	local-fake-extension	207	1.0000	1.0000	1.0000	1.0000	1.22	0.003	0.005	0.0000	0.000	keep	dynamic react async controls choose option local
16c5cdc	real-chrome-extension-smoke	191	0.9686	0.9686	1.0000	1.0000	1.09	0.011	0.126	0.0000	0.000	discard	dynamic react async controls choose option real smoke
16c5cdc	real-chrome-extension-smoke	191	1.0000	1.0000	1.0000	1.0000	1.08	0.012	0.129	0.0000	0.000	keep	dynamic react async controls choose option real smoke
16c5cdc	real-chrome-extension-agent	201	1.0000	1.0000	1.0000	1.0000	1.16	0.011	0.567	0.0000	1.428	keep	dynamic react async controls choose option real agent
